Asin,Brand,Title,price,keywords,protection_plans,variants,categories,Bestsellers_rank,Rating,Ratings_total,weight,Dimensions,Bundles,Frequently_bought_together,Newer_model,Connectivity_Technology,Printing_Technology,Special_Feature,Color,Printer_Output,Maximum_Print_Speed_Color,Max_Printspeed_Monochrome,Controller_Type
B0BVW1ZMR8,Memoqueen,"Phomemo Bluetooth Thermal Label Printer 4X6 - Wireless Shipping Label Printer for Shipping Packages & Small Business, Compatible with iOS & Android, for USPS, Etsy Amazon Shopify，Pink and White", ,21,,3,Electronics,0,4.3,117, ,"5""D x 7""W x 6""H",0,2,No,"Bluetooth, USB",Thermal,"✅Thermal Printing, ✅Bluetooth and Usb Connection, ✅IOS & Android Phone/Pad, Mac OS, Windows, Chrome OS, Linux, ✅High Speed Shipping Label Printer, ✅Lower Cost ✅Stylish ✅Compact See more",Pink,Monochrome, ,"5""D x 7""W x 6""H",
B085VMW9YD,Canon,Canon PIXMA TR150 Wireless Portable Printer New,199,6,3,3,Electronics,1283,4.5,3566,4.5 Pounds,7.3 x 12.7 x 2.6 inches,0,2,No,"Wi-Fi, USB",Inkjet,"portable,wireless",Black,Color,5.5 ppm,9 ppm,
B0CSJHBKHF,Q-image,"952XL Ink cartridges Combo Pack for HP 952 XL 952XL Work for HP Officejet Pro 7740 8710 8715 8210 8720 8725 8740 8730 8200 7720 8702 Printer(Black, Cyan, Magenta, Yellow) 4 Packs",49.99,22,,1,Electronics,134836,4.3,113,9.9 ounces,4.8 x 4.1 x 2.8 inches,0,2,No,Q-image, ,2000, ,Compatible, ,7740 8710 8715 8720 8210 7720 8740 8725,
B08VDS4Y5H,HP,"HP Laserjet MFP M234sdw Wireless Black/White All-in-One Laser Printer, Instant Ink Ready (6GX01F#BGJ)",179,10,3,,Electronics,12495,4.2,202,21 Pounds,"12.13""D x 16.46""W x 11.59""H",0,0,No,Wi-Fi,Laser,"Auto-Duplex, Network-Ready, Energy Star Certified, Cloud Print Enabled, Works with Alexa",Gray,Monochrome, ,21 Pounds,
B01JUCLLGK,HP,"HP OfficeJet Pro 7740 Wide Format All-in-One Color Printer with Wireless Printing, Works with Alexa (G5J38A), White/Black",289.99,15,3,,Electronics,3832,4.2,3910,42.9 Pounds,18.38 x 23 x 15.1 inches,0,2,No,"wired, wireless",Inkjet,"Double Sided Scanning, Auto-Duplex, Energy Star, Touch Screen, Auto Document Feeder, Borderless Printing See more",White/Black,Color,34 ppm,22 ppm,
B0CCVGD5TJ,JADENS,"JADENS Portable Printers Wireless for Travel, Support 8.5"" X 11"" US Letter, Bluetooth Thermal Printer Compatible with iOS, Android & Laptop, Inkless Mobile Printer for Office, Home, School White",139.99,21,3,3,Electronics,1129,4.2,864,688 Grams,"10""D x 1.8""W x 3.1""H",1,2,No,Bluetooth,Thermal,Wireless,White,Monochrome, ,688 Grams,
B0CF9B6ZNT,ST-CARE,"Mini Pocket Bluetooth Printer-Portable Thermal Printer with 10 Roll Papers for Journal/DIY Scrapbook/Travel/Notes/Lists/Label/Memo, Receipt Printer for Children Women Gifts Kids Christmas IOS&Android X5-white",24.99,19,,12,Electronics,20196,4.2,1059,8 ounces,4.6 x 3.8 x 2 inches,0,2,No,Portable, ,8 ounces, ,Portable, ,203 x 203 DPI,
B0CF9CHLMX,ST-CARE,"Mini Pocket Bluetooth Printer-Portable Thermal Printer with 5 Roll Papers for Journal/DIY Scrapbook/Travel/Notes/Lists/Label/Memo, Receipt Printer for Children Women Gifts Kids Christmas iOS&Android X5-pink",23.99,19,,12,Electronics,20196,4.2,1059,0.54 Pounds,4.6 x 3.8 x 2 inches,0,2,No,Bluetooth,Thermal,Portable,X5-pink,0.54 Pounds, ,"Labels, Glossy photo paper",
B08PZ1S5LW, ,The Printer,2.99,1,,2,Kindle Store,0,5,1, , ,0,0,No, , , , , , ,,
B0BJ194Z43,HP,HP Laserjet Pro MFP 3101fdw Wireless Laser All-in-One Monochrome Printer,309,7,3,,Electronics,12398,4.5,91,26.85 Pounds,"16.5""D x 12.3""W x 15.7""H",0,0,No,USB,Laser,"Auto-duplex, Works with Alexa",white,Monochrome, ,26.85 Pounds,
B0C1MHDB9V,POOOLITECH,"Portable Printer Wireless Bluetooth Connection, POOOLITECHxHPRT Inkless Mobile Printers Compatible with Phones & PCs, Compact Printers for Travel Home Office Vehicles black",132.99,18,3,2,Electronics,0,4.3,1228,2.7 Pounds,"2.5""D x 12.2""W x 1.6""H",0,2,No,Bluetooth,Thermal,"Wireless Bluetooth, Inkless Thermal, Portable Mobile",black,Monochrome, ,2.7 Pounds,
B0BWMMDYR4,Ankink,Ankink Remanufactured Ink Cartridge Replacement for Epson 410XL 410 XL T410XL (Black and Tricolor 5-Pack) to use with XP-7100 XP-830 XP-640 XP-630 XP-530 XP-635 XP7100 Printer,25.49,19,,,Electronics,8675,4.3,184,6.4 ounces,3.15 x 4.33 x 2.56 inches,0,2,No,Ankink, ,500, ,Remanufactured, ,,
B0BL466Y41,HP,"HP Smart -Tank 5101 Wireless Cartridge-free all in one printer, up to 2 years of ink included, mobile print, scan, copy (1F3Y0A) , White ST 5001",189.99,14,3,2,Electronics,498,4.1,2019,11.1 Pounds,14.23 x 17.11 x 6.19 inches,0,2,No,"Wi-Fi, USB",Inkjet,Refillable Ink Tank,White,Color,5 ppm,12 ppm,
B0BB6893LL,Relcolor,Relcolor Compatible Ink Cartridge Replacement for Canon 245XL 246XL (Black Color 2 Pack) 245 246 XL PG245 CL246 MX490 MG2522 MX492 TR4520 TR4500 MG2520 TS3300 TS3322 MG2525 TR4522 TS3100 TS3122 TS3320,34.99,25,,,Electronics,2834,4.4,830,1.76 ounces,4.33 x 1.57 x 3.15 inches,1,2,No,Black Color, ,Printer, ,Black Color, ,,
B01MZD55F2,HP,"HP LaserJet Pro MFP M227fdn Monochrome All-in-One Printer with built-in Ethernet & 2-sided printing, (G3Q79A)",199,11,3,,Office Products,77962,4.2,345,20 Pounds,‎15.9 x 12.3 x 16 inches,0,2,No,USB,Laser,Auto-Duplex,White,Color,35,30 ppm,
B0CLL5PFZJ,MUNBYN,"MUNBYN Storage Carrying Case Compatible with Peripage A40 Portable Printer, Compatible Portable Printer ITP01 Wireless Thermal Printer, Compact Waterproof Shockproof Scratch-resistant",19.99,20,,,All Departments,46472,4.8,42,9.1 ounces,11.42 x 2.76 x 3.94 inches,0,2,No, , , , , , ,,
B0963Z1YR9,Makeid,"Makeid Label Maker Machine with Tape - Compatible with 9/12/16mm Waterproof Tape, Portable & Rechargeable with Built-in Cutter Wireless Label Printer Compatible with Android & iOS Devices Standard(203dpi) Beige",28.99,23,,6,Office Products,1477,4.4,3816,4.4 ounces,16.14 x 39.37 x 19.69 inches,9,2,yes,100*40*55.5mm, , , , , ,,
B0BYYLQVYL,Phomemo,"Phomemo Label Maker - Label Maker Machine with Tape P12, Portable Bluetooth Label Printer Handheld Built-in Cutter Small Label Maker, Mini Thermal Transfer Printer with Template for Product Organizing pink",19.99,26,,4,Electronics,751,4.3,2041,180 Grams,"4.09""D x 3.52""W x 2.7""H",11,0,yes,Bluetooth,Thermal & Thermal Transfer,"Mini labeler sticker maker can print black or color labels, Label maker refills are cold-resistant and oil-resistant, Bluetooth label makers can be connected in just 2 seconds, Portable label maker can print fabric and satin ribbon label refills, Small label maker for organizing jars storage See more",pink,Monochrome/Color, ,"4.09""D x 3.52""W x 2.7""H",
 , , , , ,,, ,0, , , , ,0,0,No, , , , , , ,,
B0BZKG5WY3,Betife,"Betife Portable Printers Wireless for Travel M08F Wireless Bluetooth Printer Support 8.5"" X 11"" US Letter, Inkless Thermal Compact Printer Compatible with Android and iOS Phone & Laptop Black&Green Letter Printer",159.99,21,2,6,Electronics,11758,4.6,223,2.05 pounds,"12.2""D x 2.66""W x 1.6""H",2,2,yes,Bluetooth,Thermal,"Bluetooth,Portable,Wireless",Black&Green,Monochrome, ,,"iOS, Android"
B0CGX45TCX,cabaro,"Mini Printer Sticker Thermal Printer with 3 Rolls Paper, Bluetooth Portable Phone Printer,Study Printer for Pictures, Photos, Journals, DIY, Compatible with Phone & Tablet. GREEN",29.99,21,,2,Electronics,2026,4.4,110,160 Grams,4.3 x 2.5 x 2 inches,0,2,No,Bluetooth,🏆Popular Thermal Printer,Portable,GREEN,Monochrome,120 ppm,120 ppm,
B0CJF6H4SV,Rhomba,"Printer Ink 67 67xl 67 XL Replacement for HP Ink 67 HP Printer Ink 67 HP 67 Ink Cartridges Black Color Combo Pack Deskjet 4100 2700 Ink Cartridges (1 Black, 1 Tri-Color, 2 Pack)",25.9,16,,,Electronics,19742,4.1,123,5.3 ounces,2.5 x 2.5 x 2.5 inches,0,2,No,Rhomba, ,600, ,Remanufactured, ,,
B0BTY4BPZV,Epson,"Epson EcoTank ET-2850 Wireless Color All-in-One Cartridge-Free Supertank Inkjet Printer, White - Print Scan Copy - 1.44"" LCD Display, 10 ppm, 4800 x 1200 dpi, 2-Sided Printing, Voice-Activated",259,21,3,,Electronics,28463,4.5,72,11.9 Pounds,"13.7""D x 14.8""W x 7.4""H",0,2,No,"Wi-Fi, USB",Inkjet,Wireless,White,Color, ,"13.7""D x 14.8""W x 7.4""H",
B0722C491T,HP,"HP 64XL Tri-color High-yield Ink Cartridge | Works with HP ENVY Inspire 7950e; ENVY Photo 6200, 7100, 7800; Tango Series | Eligible for Instant Ink | N9J91AN",55.89,19,,3,Office Products,108,4.7,17360,1.6 ounces,4 x 1 x 10 inches,0,0,No,HP, ,415, ,OEM, ,"HP ENVY Photo 7864, HP ENVY Photo 7830, HP OfficeJet 2624, HP ENVY Photo 7855, HP ENVY Photo 7858",
B0016P8Q0Y,HP,"HP 60XL Black High-yield Ink Cartridge | Works with DeskJet D1660, D2500, D2600, D5560, F2400, F4200, F4400, F4580; ENVY 100, 110, 120; PhotoSmart C4600, C4700, D110a Series | CC641WN",65.89,22,,,Office Products,5313,4.7,4590,‎2.24 ounces,‎1.5 x 2.5 x 4.5 inches,0,0,No,HP, ,600, ,OEM, ,"HP ENVY 110-D411a, HP ENVY 110-D411b, HP DeskJet F4293, HP DeskJet F4492, HP DeskJet F4294, HP DeskJet F4250, HP DeskJet F4292, HP DeskJet D2663, HP DeskJet F4210, HP DeskJet F4450, HP DeskJet F4213, HP DeskJet F2476, HP PhotoSmart C4610, HP DeskJet F2430, HP DeskJet D2660, HP DeskJet D1658, HP PhotoSmart C4650, HP ENVY 100, HP DeskJet D2545, HP PhotoSmart C4690, HP ENVY 111-D411d, HP DeskJet F4480, HP DeskJet F4283, HP DeskJet F4280, HP DeskJet F4440, HP PhotoSmart C4700, HP DeskJet F4240, HP DeskJet D5545, HP DeskJet D1620, HP DeskJet F4483, HP DeskJet D1663, HP PhotoSmart C4783, HP ENVY 100-D410b, HP DeskJet F4400, HP DeskJet F2420, HP PhotoSmart C4740, HP ENVY 100-D410a, HP DeskJet F4288, HP DeskJet D1660, HP ENVY 114-D411c, HP PhotoSmart C4780, HP DeskJet F2423, HP DeskJet D1668, HP DeskJet F4470, HP DeskJet F4272, HP DeskJet F4473, HP DeskJet F4275, HP DeskJet F2493, HP PhotoSmart C4799, HP DeskJet D2563, HP PhotoSmart C4635, HP DeskJet F4273, HP DeskJet D2566, HP DeskJet F4472, HP DeskJet F4274, HP DeskJet F4230, HP DeskJet F2492, HP DeskJet D1630, HP PhotoSmart C4750, HP DeskJet F4235, HP DeskJet D2560, HP PhotoSmart C4795, HP DeskJet F2410, HP DeskJet D2680, HP DeskJet F4435, HP ENVY 120, HP DeskJet F4238, HP ENVY 121, HP DeskJet D2645, HP DeskJet D2568, HP DeskJet F2418, HP DeskJet D5560, HP DeskJet F4580, HP PhotoSmart C4600, HP DeskJet F4583, HP DeskJet F2483, HP DeskJet D5568, HP DeskJet D2530, HP DeskJet F2480, HP PhotoSmart D110a, HP PhotoSmart C4640, HP PhotoSmart C4685, HP DeskJet F4500, HP DeskJet F2440, HP DeskJet D5563, HP PhotoSmart C4680, HP DeskJet F2488, HP DeskJet F2400, HP PhotoSmart C4683, HP ENVY 110, HP ENVY 111, HP ENVY 114 See more",
B09TPZ3HLZ,HP,"HP Smart -Tank 6001 Wireless Cartridge-Free all in one printer, this ink -tank printer comes with up to 2 years of ink included, with mobile print, scan, copy (2H0B9A)",239.99,19,3,,Electronics,2604,4.1,1370,14.1 Pounds,16.83 x 7.82 x 14.33 inches,0,2,No,"wired, wireless",Inkjet,"Auto-Duplex, Network-Ready, Refillable Ink Tank, Borderless Printing",Gray,Color,7 ppm,12 ppm,
B09TGB62D8,Canon,"Canon PIXMA TR7020a All-in-One Wireless Color Inkjet Printer, with Duplex Printing, Mobile Printing, and Auto Document Feeder, Black, Works with Alexa Printer TR7020a BK -1.44"" OLED Display",99,20,3,3,Electronics,2422,4.2,2141,18.1 Pounds,15.9 x 14.4 x 8.2 inches,0,0,No,wireless,Inkjet,"Network-Ready, Display Screen, Auto Document Feeder",Black,Color,6.8 ppm,13,
B07PDNS5CZ,Epson,"Epson Expression Premium XP-6100 Wireless Color Photo Printer with Scanner and Copier, Black, Medium",99.99,13,3,6,Electronics,3773,4.1,4643,14.6 Pounds,5.39 x 7.8 x 2.2 inches,0,2,No,Wireless,Inkjet,Voice Activated Printing,Black,Color,11.3 ppm,15.8 ppm,
B09ZHG3RW3,ASprink,"ASprink Bluetooth Thermal Label Printer, 241BT Wireless Shipping Label Printer for Small Business & Packages, Pink Thermal Label Printer Shipping Label Maker, Compatible with iPhone, USPS, Amazon White Pink",119.99,25,2,6,Electronics,1042,4.3,1980,3.01 pounds,"8.66""D x 6.3""W x 4.4""H",10,2,No,Bluetooth,Thermal,Portable,White Pink,Monochrome, ,"8.66""D x 6.3""W x 4.4""H",
B0CPLF5VP5,Brother,"Brother HL-L2400D Compact Monochrome Laser Printer with Duplex Printing, USB Connection, Black & White Output New: HLL2400D",119.99,13,3,4,Electronics,1981,4.4,10876,15.6 Pounds,"14.2""D x 14""W x 7.2""H",0,2,No,USB,Laser,"Auto-Duplex, Energy Star, Epeat Qualified",Black,Monochrome, ,15.6 Pounds,
B0C2Q1QVWV,Valinkso,"Remanufactured Ink Cartridges Replacement for Canon 245XL 246XL Compatible with MX490 MX492 MG2522 TS202 TS302 TR4520 TS3122 MG3022 MG2520 TR4522 TS3120 Printer (1 Black,1 Tri-Color,2 Pack)",28.46,23,,,Office Products,20684,4.6,224,‎3.84 ounces, ,0,2,No,Valinkso, ,400, ,Compatible, ,"Canon PIXMA MG3020, Canon PIXMA TR4522, Canon PIXMA MG3022, Canon PIXMA TR4520, Canon PIXMA MG2520, Canon PIXMA MG2420, Canon PIXMA MX492, Canon PIXMA MG2522, Canon PIXMA MG2920, Canon PIXMA MG3029, Canon PIXMA MG2922, Canon PIXMA MX490, Canon PIXMA MG2525, Canon PIXMA MG2924, Canon PIXMA TS3300, Canon PIXMA TS3322, Canon PIXMA TS3120, Canon PIXMA TS302, Canon PIXMA TS3122, Canon PIXMA TS3100, Canon PIXMA TS3320, Canon PIXMA TS202, Canon PIXMA TR4527, Canon PIXMA iP2820 See more",
B00E3FEET6,Epson,"EPSON 200 DURABrite Ultra Ink High Capacity Black & Standard Color Cartridge Combo Pack (T200XL-BCS) Works with WorkForce WF-2520, WF-2530, WF-2540, Expression XP-200, XP-300, XP-310, XP-400, XP-410, Black and color combo pack Black and color combo pack Multi-Pack Ink",57.69,28,,6,Office Products,0,4.6,4889, , ,0,0,No,Epson, ,Printer, ,Black and color combo pack, ,,
B0B741ZK1H,Ubinki,"Ubinki Remanufactured Ink Cartridge Replacement for HP 65XL 65 Ink (Black,2-Pack) HP65 XL HP65XL for 5000 5055 3755 3700 3772 3722 2600 3752 2652 2655 2622 2640 5052 5010 5070 5014 Printer",23.99,26,,,Electronics,7484,4.4,162,3.52 ounces,2.66 x 1.47 x 4.23 inches,0,2,No,Black, ,Printer, , , ,,
B0CM6HQPQ8,Ubinki,"DR820 Drum Unit DR-820 Compatible Replacement for Brother Drum DR820 DR-820 DR 820 for HL-L6200DW MFC-L5900DW MFC-L5850DW HL-L5200DW HL-L5100DN L5850DW L5900DW L5700DW L6200DW Printer (Black, 2-Pack)",49.99,22,,,Electronics,130236,4.7,4,3.06 pounds, ,0,2,No,Black, , ,Black, , ,,
B0BTKJF469,HuiJuKeJi,"HuiJuKeJi Mini Sticker Printer Bluetooth Smart Pocket Inkless Thermal Printer with 11 Rolls Thermal Paper and Sticker for iOS&Android, Portable Receipt Printer for Photo Journal Notes Memo - Pink",26.99,24,,5,Electronics,7048,4.3,1360,210 Grams,1.8 x 3.2 x 3.2 inches,0,2,No,Bluetooth,"Thermal, APP, Inkless",mini pocket Thermal Printer with 11 Rolls Thermal Paper,Pink,Monochrome,1.00,1.00,
B08XZQ4ZSN,Canon,"Canon CL-276 Color Ink Cartridge, Compatible to PIXMA TS3520, TS3522 and TR4720 Printers",21,10,,,Office Products,1457,4.6,1584,‎1.6 ounces,‎3.4 x 2.1 x 2 inches,0,2,No,Canon, ,Printer, ,Multi, ,,
B07T1DQNNS,Lexmark,Lexmark MC3224dwe All-in-One Color Printer,243.99,5,3,,Electronics,23780,4,1082,40.2 Pounds,15.5 x 16.2 x 12.1 inches,0,2,No,USB,Laser,"Auto-Duplex, Portable, Network-Ready","White, Gray",Color,24 ppm,24 ppm,
B0C6LYRMCN,HPRT,"HPRT GT1 Thermal Transfer Inkless Printer for Home Use, Wi-Fi Connection Supports 11''x8.5'' US Letter 300DPI High Resolution Printer (GT1-White)",139.99,16,2,1,Electronics,50387,3.9,123,2.47 Kilograms,5.78 x 11.63 x 2.71 inches,3,2,No,USB,Thermal,"Portable, Remote Control, Wi-Fi Connection, APP Supported",GT1-White,Monochrome,15,20,
B0101SI6W4,Canon,"Canon PGI-280XL/CLI-281 5 Color Pack Compatible to TR8520, TR7520, TS9120 Series,TS8120 Series, TS6120 Series Printer + Ink Combo Ink", ,13,,4,All Departments,0,4.7,10122, , ,0,0,No,Canon, ,1200, ,Compatible, ,"Canon PIXMA TS6320, Canon PIXMA TR8520, Canon PIXMA TS8320, Canon PIXMA TR7520, Canon PIXMA TS8120, Canon PIXMA TS6120, Canon PIXMA TS9120 See more",
B0CSR28SS4,HP,HP Envy 6065e All-in-One Printer,69.99,4,3,,Electronics,1345,5,1,5220 Grams, ,0,2,No,"Bluetooth, Wi-Fi, Ethernet",Inkjet,Auto-Duplex,White,Color,5 ppm,7 ppm,
B08ZHZJQJH,Ankink,ANKINK Remanufactured Ink Cartridge Replacement for HP Ink 65 XL 65XL (Black and Color Combo Pack) for HP65 5055 5000 5052 5010 5070 5014 3755 3700 3772 2600 3752 2652 2655 2622 2640 Printers BK color,27.99,27,,,Electronics,2190,4.5,1471,3.84 ounces,4.33 x 1.57 x 2.76 inches,1,2,No,Ankink, ,600, ,Remanufactured, ,"HP AMP 125, HP DeskJet Ink Advantage 2640, HP ENVY 5012, HP ENVY 5014, HP ENVY 5052, HP ENVY 5030, HP ENVY 5055, HP ENVY 5010, HP ENVY 5070, HP DeskJet 3730, HP DeskJet 3752, HP DeskJet 3732, HP DeskJet 2600, HP DeskJet 3755, HP DeskJet 2622, HP DeskJet 3758, HP DeskJet 2624, HP ENVY 5020, HP ENVY 5000, HP DeskJet 2652, HP DeskJet 3721, HP DeskJet 3720, HP DeskJet 3700, HP DeskJet 3722, HP DeskJet 2655, HP DeskJet 2636, HP DeskJet 2635 See more",
B0CFNF17RH,Brother,Brother Sublimation Printer,399.99,3,3,3,Electronics,10464,4.4,57,19.26 pounds,"10.8""D x 20.1""W x 19.1""H",0,2,No,Wi-Fi,Dye Sublimation,Display Screen,White,Color,0.01,0.01,
B0CHM7V6F4,Vicbear,"16 Rolls Mini Thermal Printer Paper, Including 6 Rolls Thermal Sticker Paper & 10 Rolls Thermal Plain Paper for Mini Portable Printers, 57X25mm, Suitable for Various Inkless Sticker Printers",14.95,23,,,Office Products,106122,4.3,10,‎10.8 ounces,‎2.24 x 0.98 x 0.1 inches,0,2,No,White, ,2.24X177; 2.24X118 Inches,White, , ,,
B07X5SKYPD,E-Z Ink,E-Z Ink (TM Compatible Ink Cartridge Replacement for Canon PGI-280XXL PGI 280 XXL Compatible with PIXMA TR7520 TR8520 TS6120 TS6220 TS8120 TS8220 TS9120 TS9520 TS9521C Printer (2 PGBK),16.99,19,,,Office Products,2955,4.7,2652,‎3.84 ounces, ,0,2,yes,E-Z Ink, ,600, ,Compatible, ,"Canon PIXMA TS9520, Canon PIXMA TR7520, Canon PIXMA TR7620, Canon PIXMA TS9100, Canon PIXMA TR7500, Canon PIXMA TS9120, Canon PIXMA TS702, Canon PIXMA TS9521C, Canon PIXMA TS6200, Canon PIXMA TS6320, Canon PIXMA TS6100, Canon PIXMA TS8322, Canon PIXMA TS8300, Canon PIXMA TS6300, Canon PIXMA TR8520, Canon PIXMA TS8320, Canon PIXMA TS8100, Canon PIXMA TR8620, Canon PIXMA TS8222, Canon PIXMA TS8200, Canon PIXMA TR8500, Canon PIXMA TS8120, Canon PIXMA TS6220, Canon PIXMA TR8622, Canon PIXMA TS8220, Canon PIXMA TS6120 See more",
B0BSMJM9W1,Canon,"Canon Color imageCLASS LBP632Cdw Wireless Mobile Ready Laser Printer, 22ppm,White",199,11,3,,Electronics,5489,4.1,348,35.3 Pounds,16.5 x 17 x 11.3 inches,0,2,No,"wired, wireless",Laser,"Auto-Duplex, Network-Ready, Energy Star, Epeat Qualified, Display Screen",LBP632Cdw,Color,22 ppm,22 ppm,
B00AAU54TW,Linksys,Linksys E1200 Wi-Fi Wireless Router with Linksys Connect Including Parental Controls (Renewed),89.99,12,3,,Electronics,70606,4,1799,200 Grams,‎9.84 x 4.96 x 6.46 inches,0,2,No,FBA_E1200-AP, ,802.11n, ,Security, ,For Canada Only,
B0CM3BZ7QF,PRINHSJI,"PRINHSJI Pocket Printer for iOS&Android,Wireless Mini Sticker Printer with 10 Rolls Thermal Paper, Mini Pocket Bluetooth Thermal Printers, Portable Receipt Printer for Photo Journal Notes Memo,Purple",27.99,25,,2,Electronics,78581,3.6,18,416.6 Grams,3.24 x 3.24 x 1.57 inches,0,0,No,Bluetooth,"Mini,Portable",Portable,Purple,Monochrome,10 ppm,10 ppm,
B0CCRQTGGS,Airmall,"Embossing Label Maker,Omega S Vintage Embossed Label Maker Machine, Old School Label Printer, Protable Handheld Retro Embosser Labeler with 6 Rolls 3D Embossing Label for Home School Kitchen and DIY Blue with Black*3、Pink、Lake Blue、Lake Green",22.99,24,,7,Electronics,0,3.7,220, ,"5""D x 3""W x 5""H",0,2,No,Manual,Manual Embossing,"Embossing label maker，Retro Label maker, Handheld Label Maker, Old school Label maker, Embossing Label Maker, Vintage label maker See more",Blue with Black*3、Pink、Lake Blue、Lake Green,Color,5,5,
B0BTM83TWB,XJI,"XJI Remanufactured Ink Cartridges Replacement for HP Ink 61 XL 61XL HP61 HP61XL Combo Pack, for Envy 4500 4502 5530 OfficeJet 4630 DeskJet 1000 1010 2540 3000 3050 Printer(Black Tri-Color, 2 Pack)",19.96,23,,,Electronics,11873,4.2,279,4.2 ounces, ,0,2,No,XJI, ,710, ,"Remanufactured, Compatible", ,,
B08XYRVSRT,HP,"HP ENVY 6055e Wireless Color Inkjet Printer, Print, scan, copy, Easy setup, Mobile printing, Best-for-home, Instant Ink with HP+,white New", ,17,,2,Electronics,0,4,10497,11.5 Pounds, ,0,2,No,"wired, wireless",Inkjet,auto-duplex,white,Color,7 ppm,10 ppm,
B00HM0IVDY,Canon,"Canon Pixma iX6820 Wireless Business Printer with AirPrint and Cloud Compatible, Black",179,11,3,1,All Departments,10166,4.2,4079,17.9 Pounds,12.3 x 23 x 6.3 inches,0,2,No,Wireless;Ethernet; USB,Inkjet,"Quiet Mode, AirPrint and Google Cloud Print, 5-Color Ink System, Auto Power On and Off Settings",Black,Color,10.4 ppm,14.5 ppm,
B00L1G7OMO,HP,"HP 62XL Tri-color High-yield Ink | Works with HP ENVY 5540, 5640, 5660, 7640 Series, HP OfficeJet 5740, 8040 Series, HP OfficeJet Mobile 200, 250 Series | Eligible for Instant Ink | C2P07AN",45,21,,,Office Products,437,4.7,16450,‎2.08 ounces,‎4 x 1 x 10 inches,0,0,No,HP, ,415, ,OEM, ,"HP ENVY 8005e, HP ENVY 8005, HP ENVY 8000, HP ENVY 7645e, HP OfficeJet 5743, HP OfficeJet 5744, HP OfficeJet 5745, HP OfficeJet 5746, HP OfficeJet 200, HP ENVY 5549, HP OfficeJet 5740, HP ENVY 5548, HP OfficeJet 5741, HP OfficeJet 5742, HP ENVY 5644, HP ENVY 5545, HP ENVY 5665, HP ENVY 5643, HP ENVY 5544, HP ENVY 7645, HP ENVY 5646, HP ENVY 5547, HP ENVY 5546, HP ENVY 7643, HP ENVY 5662, HP ENVY 5640, HP ENVY 5541, HP ENVY 7644, HP ENVY 5661, HP ENVY 5540, HP ENVY 5664, HP ENVY 5642, HP ENVY 5543, HP ENVY 5663, HP ENVY 5542, HP OfficeJet 8040, HP ENVY 7640, HP ENVY 7640e, HP ENVY 5660, HP OfficeJet 635, HP OfficeJet 8045, HP OfficeJet 258, HP OfficeJet 252, HP OfficeJet 6301, HP OfficeJet 250, HP ENVY 8000e See more",
B08NY1QVDZ,HP,"HP DeskJet Plus 4158 All-in-One Inkjet Printer, Scanner, Copy, Mobile Print, Instant Ink Ready, Wireless Printers for Home and Office, Dual-band Wi-Fi, 7FS76A (Renewed)",69.99,20,,,Electronics,1298,4,929,12.82 pounds,"13.07""D x 16.85""W x 7.87""H",0,2,No,Wi-Fi,Inkjet,"Wireless, Scan To E-Mail, Auto Document Feeder, Double Sided Scanning", ,Android, ,"Photo, Sheetfed",
B00AH9JVLS,Canon,"Canon PGI-250XL PGBK Compatible to iP7220,iX6820,MG5420,MG5520/MG6420,MG5620/MG6620,MX922/MX722,iP8720,MG6320,MG7120,MG7520 Printers PGI-250XL Black Ink",27,15,,7,All Departments,2224,4.7,5479,1.6 ounces,2.7 x 1.2 x 5.8 inches,0,2,No,Canon, ,500, ,Compatible, ,"Canon PIXMA MG6320, Canon PIXMA MX722, Canon PIXMA MG7120, Canon PIXMA MG6620, Canon PIXMA MG5520, Canon PIXMA MG5620, Canon PIXMA MG5422, Canon PIXMA MG6420, Canon PIXMA MG7520, Canon PIXMA MG5420, Canon PIXMA iX6820, Canon PIXMA iP7220, Canon PIXMA MG5522, Canon PIXMA MG5622, Canon PIXMA MG5600, Canon PIXMA iP8720, Canon PIXMA MX922 See more",
B0C6MT1LG2,LabelCreate,"T02 Sticker Printer, 【2024 New Upgrade】 Mini Thermal Printer, Sticker Printer Machine, Bluetooth Wireless Portable Printer for Kids Birthday, New Year Gift 1 Printer + 1 Paper Green",37.49,18,,6,Electronics,103974,4.4,94,8.8 ounces,"3.54""D x 3.42""W x 1.57""H",6,2,No,Bluetooth Sticker Printer for Smartphone & Tablets,T02 Mini Thermal Sticker Printer,"Attention: Bluetooth connection in APP instead of phone setting system! T02 inkless sticker printer, t02 bluetooth mini printer, t02 mini pocket sticker printer, t02 mini pocket sticker printer, t02 portable mini printer sticker maker machine for New Year Gift See more",Green,Monochrome inkless mini printer sticker maker, ,,"A Bluetooth sticker printer compatible with both iOS and Android devices, including iPhones, Android phones, iPads, and Android tablets. See more"
B0CMVZRPPN,The Yellow Brand,"Label Printer, Bluetooth Thermal Printer, 4x6 Shipping Label Printer, Thermal Label Printer Desktop or Phone, Compatible with iPhone, Android, Windows, Mac, Chromebook, Amazon, Ebay, UPS.USPS",69,22,2,,Electronics,29653,5,4,2.3 Pounds,"4""D x 6""W x 2""H",0,2,No,"Bluetooth, USB, Download our APP",Thermal,"Wireless, Bluetooth, Auto Document Feeder, Compact",Black and Yellow,Monochrome, ,2.3 Pounds,
B084CN3437,Canon,"Canon SELPHY QX10 Portable Square Photo Printer for iPhone or Android, Pink Pink Printer",129.99,10,3,8,Office Products,0,4.7,102,15.52 ounces,"5.65""D x 4.02""W x 1.23""H",0,2,No,USB,Dye Sublimation,Portable,Pink,Color,43 ppm,15.52 ounces,
B0CTQ34ZK7,WORTHDO,822XL Remanufactured for Epson 822XL Ink Cartridges for Epson 822 XL for Epson Workforce Pro WF-3820 WF-3823 WF-4820 WF-4830 WF-4833 WF-4834 Printer 2 Black, ,16,,,Electronics,349915,4.1,878,4.2 ounces,1 x 1 x 1 inches,0,0,No,WORTHDO, ,1100, ,Remanufactured, ,,
B01997163Y,Hammermill,"Hammermill Printer Paper, Premium Multipurpose Paper 24 lb, 8.5 x 11-1 Pallet (160,000 Sheets) - 97 Bright, Made in the USA, 105810P Pallet | 160k Sheets 24 lb", ,13,,6,Office Products,648,4.8,7224,2125 Pounds,‎46.5 x 35 x 52 inches,0,0,No,"Yellow,White", ,Smooth,"Yellow,White", , ,,
B0BHXNP6B1,Epson,"Epson EcoTank ET-2803 Wireless Color All-in-One Cartridge-Free Supertank Printer with Scan, Copy and AirPrint Support White EcoTank ET-2803 Printer",199.99,14,3,10,Electronics,82,4.4,8388,8.8 Pounds,22.8 x 14.8 x 10 inches,0,2,No,"Wi-Fi, USB",Inkjet,"Scanning, Refillable Ink Tank",White,Color,5 ppm,10 ppm,
B0C7Q85VHM,Zoolion,"T02 Mini Sticker Printer, Sticker Printer Machine with 3 White Paper Rolls Gift Box Set, Mini Printer Sticker Printer, Memoking Label Makers, Inkless Sticker Printer for Photo, Journal, Memo Pink 1 Printer + 3 Roll Paper",42.99,24,,6,Electronics,132197,4,164,11.3 ounces,"6.61""D x 1.89""W x 6.5""H",5,2,No,Bluetooth,Thermal,Portable,Pink,Monochrome,15,15,
B0BB2K5GFW,GZBCKJ,"QY6-0083 Color Printhead, Canon Printhead Replacement for Canon MG7180 iP8720 iP8750 iP8780 7110 MG7520",40.99,13,1,,Electronics,65183,3.5,16,3.2 ounces, ,0,2,No,GZBCKJ, ,Printer, ,Multicolor, ,,
B09BBLN72F,HP,"HP ENVY Inspire 7955e Wireless Color Inkjet Printer, Print, scan, copy, Easy setup, Mobile printing, Best-for home, Instant Ink with HP+,White New",179.99,19,3,2,Electronics,5659,4.1,2635,17.9 Pounds,15.08 x 18.11 x 9.21 inches,0,0,No,"wired, wireless",Inkjet,"Sustainable design made of over 45% recycled plastic, True-to-phone color quality prints, Dedicated photo tray for seamless printing, Automatic document feeder, Two-sided photo printing, Dynamic security enabled printer See more",White,Color,10 ppm,15 ppm,
