Asin,Brand,Title,price,keywords,protection_plans,variants,categories,Bestsellers_rank,Rating,Ratings_total,weight,Dimensions,Bundles,Frequently_bought_together,Newer_model,Connectivity_Technology,Printing_Technology,Special_Feature,Color,Printer_Output,Maximum_Print_Speed_Color,Max_Printspeed_Monochrome,Controller_Type
B08HV3MPFD,Phomemo,"Phomemo D30 Label Maker Machine, Portable Bluetooth Mini Label Printer, Smart Phone Handheld Thermal Sticker Small Labeler Multiple Templates Font Icon Inkless for Home Office Green",23.98,23,,5,Office Products,28,4.3,16732,160 Grams,5.12 x 3.15 x 1.97 inches,10,2,yes,Bluetooth,Thermal,"Portable, Scan To E-Mail",Green,Monochrome,60 ppm,60 ppm,
B0CPYDNS98,QYCHHJ,"QYCHHJ Inkless Mini Printer for iPhone/Android/Tablet, Bluetooth Mini Thermal Printer with 8 Rolls Thermal Paper, Portable Sticker Printer for Study Notes Journal Memo Photo Picture, Black",24.99,23,,2,Electronics,100248,4.4,18,13.7 ounces,"1.5""D x 3""W x 1.5""H",0,2,No,Bluetooth,Thermal,Lightweight,Black,1,1,1,
B09BFMZ7FT,Ponek,"T02 Mini Printer Receipt Printers, Portable Pocket Thermal Point-of-Sale (POS) Equipment - Bluetooth Thermal Mini Printer for Sticky Scrapbook Yellow 1 Printer + 1 Roll Paper",29.99,16,,8,Electronics,6473,4.2,1173,150 Grams,"1.4""D x 3.3""W x 3.3""H",6,0,No,Bluetooth,Thermal,Portable,Yellow,Monochrome, ,"1.4""D x 3.3""W x 3.3""H",
B0CKXJGBT3,POLONO,"POLONO P31S Label Maker Machine with Tape, Portable Thermal Printer, Portable Bluetooth Label Printer for Organizing Storage Office Home, Sticker Maker Mini Label Maker with Multiple Templates, White",29.99,27,,5,Electronics,281,4.7,130,‎7.8 ounces,"1.89""D x 4.5""W x 6.5""H",13,2,No,Bluetooth,Thermal,"Portable, Clear Printing, Easy to Use, Rechargeable, Wireless, Inkless, Text, QR code, Barcode, Materials, Images, Time and Borders See more",White,Monochrome, ,"1.89""D x 4.5""W x 6.5""H",
B0CG1BD6H2,Simple Trending,"3 Tier Mobile Wooden Printer Stand, Multi-Purpose Office Organizer for Fax Machine, Files, Books, Black",36.97,12,2,,Electronics,38193,4.6,31,10.63 pounds,17 x 11.75 x 29.25 inches,0,2,No,Black, ,Wood,Black, , ,,
B07MJ918TJ,Aproca,Aproca Hard Travel Storage Case Fit HP OfficeJet 250 All-in-One Portable Printer Wireless Mobile Printing CZ992A (Black), ,14,,1,All Departments,0,4.4,164, , ,0,2,No,Black, ,Case,Black, , ,,
B07BC4PNCJ, ,Hawkeye and the Last of the Mohicans, ,3,,,Prime Video,0, , , , ,0,0,No, , , , , , ,,
B00WJDWGA8,HP,"HP 63XL Black High-yield Ink Cartridge | Works with HP DeskJet 1112, 2130, 3630 Series; HP ENVY 4510, 4520 Series; HP OfficeJet 3830, 4650, 5200 Series | Eligible for Instant Ink | F6U64AN",50.89,23,,2,Office Products,49,4.7,50699,‎0.176 ounces,‎4 x 1 x 10 inches,0,0,No,HP, ,430, ,OEM, ,"HP OfficeJet 3830, HP DeskJet 3630, HP OfficeJet 5255",
B07RJTZ4M6, ,Desktop Thermal Printer Set Up, ,3,,,All Departments,0, , , , ,0,0,No, , , , , , ,,
B0CNRS4Y2Z,EaseFusion,260XL 261XL Replacement for Canon 260 and 261 Ink Cartridges PG-260 CL-261 Compatible with Canon Pixma TS6420a TS6420 TR7020a TS5300 TS5320 TR7020 Printer Ink Cartridges,52.99,19,1,,Electronics,44853,4.9,20,5.3 ounces,5.12 x 2.75 x 1.49 inches,0,0,No,EaseFusion, ,700, ,"Remanufactured, Compatible", ,,
B01B6QGJ42,HP,"HP 952XL Black High-yield Ink Cartridge | Works with HP OfficeJet 8702, HP OfficeJet Pro 7720, 7740, 8210, 8710, 8720, 8730, 8740 Series | Eligible for Instant Ink | F6U19AN",57.89,20,,1,Office Products,159,4.7,15827,‎3.68 ounces,‎4 x 1 x 10 inches,0,0,No,HP, ,2000, ,OEM, ,"HP OfficeJet Pro 8740, HP OfficeJet Pro 8730, HP OfficeJet Pro 8720, HP OfficeJet Pro 8710",
B00WR23VRI,HP,"HP 63 Black/Tri-color Ink (2-pack) | Works with HP DeskJet 1112, 2130, 3630 Series; HP ENVY 4510, 4520 Series; HP OfficeJet 3830, 4650, 5200 Series | Eligible for Instant Ink | L0R46AN",54.89,21,,2,Office Products,72,4.7,41758,3.2 ounces,4 x 1 x 10 inches,0,0,No,HP, ,170, ,OEM, ,"HP OfficeJet 5264, HP OfficeJet 5232, HP OfficeJet 5260, HP OfficeJet 5255, HP OfficeJet 5258",
B01BYKD628,HP,"HP 902XL Black High-yield Ink Cartridge | Works with HP OfficeJet 6950, 6960 Series, HP OfficeJet Pro 6960, 6970 Series | Eligible for Instant Ink | T6M14AN",50.89,17,,4,Office Products,58,4.6,23250,2.88 ounces,1 x 1 x 1 inches,0,0,No,HP, ,750, ,OEM, ,"HP OfficeJet Pro 6975, HP OfficeJet Pro 6974, HP OfficeJet Pro 6970, HP OfficeJet Pro 6968, HP OfficeJet Pro 6978 See more",
B0101SI6W4,Canon,"Canon PGI-280XL/CLI-281 5 Color Pack Compatible to TR8520, TR7520, TS9120 Series,TS8120 Series, TS6120 Series Printer + Ink Combo Ink",64.55,13,,4,All Departments,393,4.7,10122,‎6.1 ounces,‎4.6 x 2.5 x 5.3 inches,0,0,No,Canon, ,1200, ,Compatible, ,"Canon PIXMA TS6320, Canon PIXMA TR8520, Canon PIXMA TS8320, Canon PIXMA TR7520, Canon PIXMA TS8120, Canon PIXMA TS6120, Canon PIXMA TS9120 See more",
B0B747ZNX1,Ubinki,"Ubinki Remanufactured Ink Cartridge Replacement for HP 65XL 65 Ink (Black and Color Combo, 2-Pack) HP65 XL HP65XL for 5000 5055 3755 3700 3772 3722 2600 2622 3752 2652 2640 5052 5010 5014 Printer",23.99,26,,,Electronics,7342,4.4,450,3.52 ounces,2.66 x 1.47 x 4.23 inches,0,2,No,Ubinki, ,650, ,"Remanufactured, Compatible", ,,
B01644VWZM,HP,"HP 62 Black/Tri-color Ink (2-pack) | Works with HP ENVY 5540, 5640, 5660, 7640 Series, HP OfficeJet 5740, 8040 Series, HP OfficeJet Mobile 200, 250 Series | Eligible for Instant Ink | N9H64FN",43.89,20,,,Office Products,83,4.7,25115,‎3.2 ounces,‎1.86 x 4.82 x 6.44 inches,0,0,No,HP, ,200, ,OEM, ,"HP OfficeJet 252C, HP OfficeJet 5743, HP OfficeJet 5744, HP OfficeJet 5745, HP OfficeJet 5746, HP OfficeJet 200, HP ENVY 5549, HP OfficeJet 5740, HP ENVY 5548, HP OfficeJet 5741, HP OfficeJet 5742, HP ENVY 5644, HP ENVY 5545, HP ENVY 5665, HP ENVY 5643, HP ENVY 5544, HP ENVY 7645, HP ENVY 5547, HP ENVY 5640, HP ENVY 5541, HP ENVY 5661, HP ENVY 5540, HP ENVY 5664, HP ENVY 5642, HP ENVY 5543, HP ENVY 5663, HP ENVY 5542, HP OfficeJet 8040, HP ENVY 7640, HP ENVY 5660, HP OfficeJet 258, HP OfficeJet 252, HP OfficeJet 250 See more",
B01BYKV8FK,HP,"HP 65XL Black High-yield Ink Cartridge | Works with HP AMP 100 Series, HP DeskJet 2600, 3700 Series, HP ENVY 5000 Series | Eligible for Instant Ink | N9K04AN",37.89,17,,2,Office Products,124,4.7,27427,‎1.6 ounces,‎4 x 1 x 10 inches,0,0,No,HP, ,300, ,OEM, ,"HP Envy 5032, HP ENVY 5034, HP ENVY 5058, HP ENVY 5052, HP ENVY 5055",
B0722C491T,HP,"HP 64XL Tri-color High-yield Ink Cartridge | Works with HP ENVY Inspire 7950e; ENVY Photo 6200, 7100, 7800; Tango Series | Eligible for Instant Ink | N9J91AN",55.89,19,,3,Office Products,108,4.7,17360,1.6 ounces,4 x 1 x 10 inches,0,0,No,HP, ,415, ,OEM, ,"HP ENVY Photo 7864, HP ENVY Photo 7830, HP OfficeJet 2624, HP ENVY Photo 7855, HP ENVY Photo 7858",
B08P18Q9WV,Fosgoit,"Printhead Cleaning Kit Inkjet Printer, Printer Cleaning Kit for Epson Ecotank Printer, Printer Cleaner Kit for HP, Inkjet Printer Head Cleaning Solution for Brother Print Head Liquid Nozzles Printer Cleaning Kit 100mL",10.59,21,,2,Electronics,2014,4.3,986,4.9 ounces,5.91 x 2.36 x 1.97 inches,0,2,No,Fosgoit, ,500, ,Compatible, ,Water,
B0CRLB559N,BKBKC,"245XL 246XL Ink Cartridges Combo Pack for Canon Ink 245 and 246 Remanufactured for Canon PG-245XL CL-246XL for Canon Pixma MX492 TR4520 MG2522 TS3322 MG2500 TR4520 Printer (1Black, Tri-Color)",44.99,21,1,,Electronics,17437,4.9,16,3.84 ounces,3.1 x 3.1 x 2.8 inches,0,2,No,"1Black, Tri-Color", ,Compatible Printers: PIXMA TR SERIES: Pixma TR4520 TR4522 TS3120 TS3122 TS3320 Pixma MX490 MX492 Printer. See more, , , ,,
B00WR23WE0,HP,"HP 63 Tri-color Ink Cartridge | Works with HP DeskJet 1112, 2130, 3630 Series; HP ENVY 4510, 4520 Series; HP OfficeJet 3830, 4650, 5200 Series | Eligible for Instant Ink | F6U61AN",33.89,21,,2,Office Products,354,4.7,42490,‎1.6 ounces,‎4 x 1 x 10 inches,0,0,No,HP, ,150, ,OEM, ,"HP OfficeJet 3830, HP OfficeJet 5255, HP OfficeJet 4650, HP DeskJet 3637, HP Envy 4520",
B00L1G7OMO,HP,"HP 62XL Tri-color High-yield Ink | Works with HP ENVY 5540, 5640, 5660, 7640 Series, HP OfficeJet 5740, 8040 Series, HP OfficeJet Mobile 200, 250 Series | Eligible for Instant Ink | C2P07AN",45,21,,,Office Products,437,4.7,16450,‎2.08 ounces,‎4 x 1 x 10 inches,0,0,No,HP, ,415, ,OEM, ,"HP ENVY 8005e, HP ENVY 8005, HP ENVY 8000, HP ENVY 7645e, HP OfficeJet 5743, HP OfficeJet 5744, HP OfficeJet 5745, HP OfficeJet 5746, HP OfficeJet 200, HP ENVY 5549, HP OfficeJet 5740, HP ENVY 5548, HP OfficeJet 5741, HP OfficeJet 5742, HP ENVY 5644, HP ENVY 5545, HP ENVY 5665, HP ENVY 5643, HP ENVY 5544, HP ENVY 7645, HP ENVY 5646, HP ENVY 5547, HP ENVY 5546, HP ENVY 7643, HP ENVY 5662, HP ENVY 5640, HP ENVY 5541, HP ENVY 7644, HP ENVY 5661, HP ENVY 5540, HP ENVY 5664, HP ENVY 5642, HP ENVY 5543, HP ENVY 5663, HP ENVY 5542, HP OfficeJet 8040, HP ENVY 7640, HP ENVY 7640e, HP ENVY 5660, HP OfficeJet 635, HP OfficeJet 8045, HP OfficeJet 258, HP OfficeJet 252, HP OfficeJet 6301, HP OfficeJet 250, HP ENVY 8000e See more",
B07DB8QN28,Printers Jack,"Printers Jack 400ML Sublimation Ink for Epson C88 C88+ WF7720 ET2720 ET4760 ET2760 ET2750 WF7820 Inkjet Printers Heat Press Transfer on Mugs, Plates, Polyester Shirts, Phone Cases etc 4 Colors Sublimation Ink",16.99,23,,4,Office Products,4276,4.7,14075,0.4 Kilograms,‎6.38 x 4.25 x 3.5 inches,0,2,No,Inkjet, ,4 Colors Sublimation Ink, ,0.4 Kilograms, ,"Banner paper, Fabric",
B01BYKB774,HP,"HP 902 Black Ink Cartridge | Works with HP OfficeJet 6950, 6960 Series, HP OfficeJet Pro 6960, 6970 Series | Eligible for Instant Ink | T6L98AN",21.89,15,,,Office Products,649,4.6,11086,‎1.12 ounces,‎1 x 1 x 1 inches,0,0,No,HP, ,300, ,OEM, ,HP OfficeJet Pro 6968,
B0C2Q1QVWV,Valinkso,"Valinkso Remanufactured Ink Cartridges Replacement for Canon 245XL 246XL Compatible with MX490 MX492 MG2522 TS202 TS302 TR4520 TS3122 MG3022 MG2520 TR4522 TS3120 Printer (1 Black,1 Tri-Color,2 Pack)",28.46,24,,,Office Products,20684,4.6,224,‎3.84 ounces, ,0,2,No,Valinkso, ,400, ,Compatible, ,"Canon PIXMA MG3020, Canon PIXMA TR4522, Canon PIXMA MG3022, Canon PIXMA TR4520, Canon PIXMA MG2520, Canon PIXMA MG2420, Canon PIXMA MX492, Canon PIXMA MG2522, Canon PIXMA MG2920, Canon PIXMA MG3029, Canon PIXMA MG2922, Canon PIXMA MX490, Canon PIXMA MG2525, Canon PIXMA MG2924, Canon PIXMA TS3300, Canon PIXMA TS3322, Canon PIXMA TS3120, Canon PIXMA TS302, Canon PIXMA TS3122, Canon PIXMA TS3100, Canon PIXMA TS3320, Canon PIXMA TS202, Canon PIXMA TR4527, Canon PIXMA iP2820 See more",
B01644VWZM,HP,"HP 62 Black/Tri-color Ink (2-pack) | Works with HP ENVY 5540, 5640, 5660, 7640 Series, HP OfficeJet 5740, 8040 Series, HP OfficeJet Mobile 200, 250 Series | Eligible for Instant Ink | N9H64FN",43.89,20,,,Office Products,83,4.7,25115,‎3.2 ounces,‎1.86 x 4.82 x 6.44 inches,0,0,No,HP, ,200, ,OEM, ,"HP OfficeJet 252C, HP OfficeJet 5743, HP OfficeJet 5744, HP OfficeJet 5745, HP OfficeJet 5746, HP OfficeJet 200, HP ENVY 5549, HP OfficeJet 5740, HP ENVY 5548, HP OfficeJet 5741, HP OfficeJet 5742, HP ENVY 5644, HP ENVY 5545, HP ENVY 5665, HP ENVY 5643, HP ENVY 5544, HP ENVY 7645, HP ENVY 5547, HP ENVY 5640, HP ENVY 5541, HP ENVY 5661, HP ENVY 5540, HP ENVY 5664, HP ENVY 5642, HP ENVY 5543, HP ENVY 5663, HP ENVY 5542, HP OfficeJet 8040, HP ENVY 7640, HP ENVY 5660, HP OfficeJet 258, HP OfficeJet 252, HP OfficeJet 250 See more",
B01BYKV8FK,HP,"HP 65XL Black High-yield Ink Cartridge | Works with HP AMP 100 Series, HP DeskJet 2600, 3700 Series, HP ENVY 5000 Series | Eligible for Instant Ink | N9K04AN",37.89,17,,2,Office Products,124,4.7,27427,‎1.6 ounces,‎4 x 1 x 10 inches,0,0,No,HP, ,300, ,OEM, ,"HP Envy 5032, HP ENVY 5034, HP ENVY 5058, HP ENVY 5052, HP ENVY 5055",
B00E3FEET6,Epson,"EPSON 200 DURABrite Ultra Ink High Capacity Black & Standard Color Cartridge Combo Pack (T200XL-BCS) Works with WorkForce WF-2520, WF-2530, WF-2540, Expression XP-200, XP-300, XP-310, XP-400, XP-410, Black and color combo pack Black and color combo pack Multi-Pack Ink",57.69,28,,6,Office Products,2952,4.6,4889,3.68 ounces,4.4 x 2.5 x 4.9 inches,0,0,No,Epson, ,Printer, ,Black and color combo pack, ,,
B00L1G7LBI,HP,"HP 62XL Black High-yield Ink | Works with HP ENVY 5540, 5640, 5660, 7640 Series, HP OfficeJet 5740, 8040 Series, HP OfficeJet Mobile 200, 250 Series | Eligible for Instant Ink | C2P05AN",50.89,21,,3,Office Products,122,4.7,26783,‎1.76 ounces,‎4 x 1 x 10 inches,0,0,No,HP, ,600, ,OEM, ,"HP ENVY 8005, HP ENVY 8000, HP OfficeJet 5743, HP OfficeJet 5744, HP OfficeJet 5745, HP OfficeJet 5746, HP OfficeJet 200, HP ENVY 5549, HP OfficeJet 5740, HP ENVY 5548, HP OfficeJet 5741, HP OfficeJet 5742, HP ENVY 5644, HP ENVY 5545, HP ENVY 5665, HP ENVY 5643, HP ENVY 5544, HP ENVY 7645, HP ENVY 5646, HP ENVY 5547, HP ENVY 5546, HP ENVY 5640, HP ENVY 5541, HP ENVY 7644, HP ENVY 5661, HP ENVY 5540, HP ENVY 5664, HP ENVY 5642, HP ENVY 5543, HP ENVY 5663, HP ENVY 5542, HP OfficeJet 8040, HP ENVY 7640, HP ENVY 5660, HP OfficeJet 8045, HP OfficeJet 6301, HP OfficeJet 250 See more",
B0722C491T,HP,"HP 64XL Tri-color High-yield Ink Cartridge | Works with HP ENVY Inspire 7950e; ENVY Photo 6200, 7100, 7800; Tango Series | Eligible for Instant Ink | N9J91AN",55.89,19,,3,Office Products,108,4.7,17360,1.6 ounces,4 x 1 x 10 inches,0,0,No,HP, ,415, ,OEM, ,"HP ENVY Photo 7864, HP ENVY Photo 7830, HP OfficeJet 2624, HP ENVY Photo 7855, HP ENVY Photo 7858",
B08P18Q9WV,Fosgoit,"Fosgoit Printhead Cleaning Kit Inkjet Printer, Printer Cleaning Kit for Epson Ecotank Printer, Printer Cleaner Kit for HP, Inkjet Printer Head Cleaning Solution for Brother Print Head Liquid Nozzles Printer Cleaning Kit 100mL",10.59,22,,2,Electronics,2014,4.3,986,4.9 ounces,5.91 x 2.36 x 1.97 inches,0,2,No,Fosgoit, ,500, ,Compatible, ,Water,
B0CRLB559N,BKBKC,"245XL 246XL Ink Cartridges Combo Pack for Canon Ink 245 and 246 Remanufactured for Canon PG-245XL CL-246XL for Canon Pixma MX492 TR4520 MG2522 TS3322 MG2500 TR4520 Printer (1Black, Tri-Color)",44.99,21,1,,Electronics,17437,4.9,16,3.84 ounces,3.1 x 3.1 x 2.8 inches,0,2,No,"1Black, Tri-Color", ,Compatible Printers: PIXMA TR SERIES: Pixma TR4520 TR4522 TS3120 TS3122 TS3320 Pixma MX490 MX492 Printer. See more, , , ,,
B00WR23WE0,HP,"HP 63 Tri-color Ink Cartridge | Works with HP DeskJet 1112, 2130, 3630 Series; HP ENVY 4510, 4520 Series; HP OfficeJet 3830, 4650, 5200 Series | Eligible for Instant Ink | F6U61AN",33.89,21,,2,Office Products,354,4.7,42490,‎1.6 ounces,‎4 x 1 x 10 inches,0,0,No,HP, ,150, ,OEM, ,"HP OfficeJet 3830, HP OfficeJet 5255, HP OfficeJet 4650, HP DeskJet 3637, HP Envy 4520",
B00L1G7OMO,HP,"HP 62XL Tri-color High-yield Ink | Works with HP ENVY 5540, 5640, 5660, 7640 Series, HP OfficeJet 5740, 8040 Series, HP OfficeJet Mobile 200, 250 Series | Eligible for Instant Ink | C2P07AN",45,21,,,Office Products,437,4.7,16450,‎2.08 ounces,‎4 x 1 x 10 inches,0,0,No,HP, ,415, ,OEM, ,"HP ENVY 8005e, HP ENVY 8005, HP ENVY 8000, HP ENVY 7645e, HP OfficeJet 5743, HP OfficeJet 5744, HP OfficeJet 5745, HP OfficeJet 5746, HP OfficeJet 200, HP ENVY 5549, HP OfficeJet 5740, HP ENVY 5548, HP OfficeJet 5741, HP OfficeJet 5742, HP ENVY 5644, HP ENVY 5545, HP ENVY 5665, HP ENVY 5643, HP ENVY 5544, HP ENVY 7645, HP ENVY 5646, HP ENVY 5547, HP ENVY 5546, HP ENVY 7643, HP ENVY 5662, HP ENVY 5640, HP ENVY 5541, HP ENVY 7644, HP ENVY 5661, HP ENVY 5540, HP ENVY 5664, HP ENVY 5642, HP ENVY 5543, HP ENVY 5663, HP ENVY 5542, HP OfficeJet 8040, HP ENVY 7640, HP ENVY 7640e, HP ENVY 5660, HP OfficeJet 635, HP OfficeJet 8045, HP OfficeJet 258, HP OfficeJet 252, HP OfficeJet 6301, HP OfficeJet 250, HP ENVY 8000e See more",
B00KDIU3FG,Epson,"EPSON 252 DURABrite Ultra Ink Standard Capacity Color Combo Pack (T252520-S) Works with WorkForce WF-3620, WF-3640, WF-7110, WF-7610, WF-7620, WF-7710, WF-7720, WF-7210 Color Combo Ink Standard Packaging",32,20,,3,Office Products,2638,4.6,5992,1.6 ounces,2.3 x 4.35 x 4.75 inches,0,2,No,Epson, ,300, ,OEM, ,"WF-3620, WF-3640, WF-7110, WF-7210, WF-7610, WF-7620, WF-7710, WF-7720",
B08ZJ13N9S,Ankink,Ankink Remanufactured Ink Cartridge Replacement for HP Ink 63 63XL (Black and Color 2-Pack) Work with 3830 4650 4652 4655 5200 5252 5255 5258 4520 4512 1112 2132 3630 3632 Printers BK Tricolor,34.99,26,,,Electronics,2198,4.4,3460,3.84 ounces,4.13 x 3.94 x 2.36 inches,2,2,yes,Ankink, ,720, ,Remanufactured, ,"HP OfficeJet 3830, HP OfficeJet 4650, HP OfficeJet 5200, HP Envy 4520, HP OfficeJet 5258",
B07DB8QN28,Printers Jack,"Printers Jack 400ML Sublimation Ink for Epson C88 C88+ WF7720 ET2720 ET4760 ET2760 ET2750 WF7820 Inkjet Printers Heat Press Transfer on Mugs, Plates, Polyester Shirts, Phone Cases etc 4 Colors Sublimation Ink",16.99,23,,4,Office Products,4276,4.7,14075,0.4 Kilograms,‎6.38 x 4.25 x 3.5 inches,0,2,No,Inkjet, ,4 Colors Sublimation Ink, ,0.4 Kilograms, ,"Banner paper, Fabric",
B01BYKB774,HP,"HP 902 Black Ink Cartridge | Works with HP OfficeJet 6950, 6960 Series, HP OfficeJet Pro 6960, 6970 Series | Eligible for Instant Ink | T6L98AN",21.89,15,,,Office Products,649,4.6,11086,‎1.12 ounces,‎1 x 1 x 1 inches,0,0,No,HP, ,300, ,OEM, ,HP OfficeJet Pro 6968,
B092Y1HZKK,Brother,Brother LC406XLBK High Yield Black Ink Cartridge,58.98,6,,1,Office Products,2382,4.6,578,7.2 ounces,1 x 1 x 1 inches,0,0,No,Brother, ,High Yield,Black, , ,,
B00UI6A0TM,Amazon Renewed,"NeatConnect Cloud Scanner and Digital Filing System for PC and Mac, 6003875 (Renewed)",367.33,8,3,,Office Products,651754,3.7,24,‎6.89 pounds,‎12.6 x 9 x 9.5 inches,0,2,No,"Receipt, Book, Text", , , , , ,,
B0101SI6W4,Canon,"Canon PGI-280XL/CLI-281 5 Color Pack Compatible to TR8520, TR7520, TS9120 Series,TS8120 Series, TS6120 Series Printer + Ink Combo Ink",64.55,13,,4,All Departments,393,4.7,10122,‎6.1 ounces,‎4.6 x 2.5 x 5.3 inches,0,0,No,Canon, ,1200, ,Compatible, ,"Canon PIXMA TS6320, Canon PIXMA TR8520, Canon PIXMA TS8320, Canon PIXMA TR7520, Canon PIXMA TS8120, Canon PIXMA TS6120, Canon PIXMA TS9120 See more",
B0CNJY5ZNP,VICTONER,TN227 TN-227BK/C/M/Y Toner Cartridge: Compatible Replacement for Brother TN227 TN223 TN 227 for MFC-L3770CDW HL-L3290CDW MFC-L3750CDW HL-L3270CDW HL-L3210CW Printer (TN-223BK/C/M/Y High Yield 5-Pack),72.99,19,,,Electronics,6569,4.5,92,4.97 pounds,13.39 x 10.04 x 4.33 inches,0,2,No,TN-227 Black Cyan Magenta Yellow 5 Pack, ,High Yield,TN-227 Black Cyan Magenta Yellow 5 Pack, , ,,
B0CRLB559N,BKBKC,"245XL 246XL Ink Cartridges Combo Pack for Canon Ink 245 and 246 Remanufactured for Canon PG-245XL CL-246XL for Canon Pixma MX492 TR4520 MG2522 TS3322 MG2500 TR4520 Printer (1Black, Tri-Color)",44.99,21,1,,Electronics,17437,4.9,16,3.84 ounces,3.1 x 3.1 x 2.8 inches,0,2,No,"1Black, Tri-Color", ,Compatible Printers: PIXMA TR SERIES: Pixma TR4520 TR4522 TS3120 TS3122 TS3320 Pixma MX490 MX492 Printer. See more, , , ,,
B071Y72MNW,HP,"HP 64 Black Ink Cartridge | Works with HP ENVY Inspire 7950e; ENVY Photo 6200, 7100, 7800; Tango Series | Eligible for Instant Ink | N9J90AN",20.89,17,,,Office Products,71,4.7,30898,‎1.12 ounces,‎4 x 1 x 10 inches,0,0,No,HP, ,200, ,OEM, ,"HP ENVY Photo 7855, HP ENVY Photo 7155, HP ENVY Photo 6255",
B0BWXS44H2,Anemec,"910XL Ink Cartridges Combo Pack Replacement for HP Ink 910 XL Compatible with OfficeJet Pro 8020 8025 8028 8035 8030 8010 8015 8018 8022 Printer (1 Black,1 Cyan,1 Magenta,1 Yellow) Black Cyan Magenta Yellow",49.99,22,,2,Electronics,3583,3.9,1618,7 ounces, ,0,2,No,Anemec, ,1200, ,Compatible, ,,
B00LGCUPQU,Brother,"Brother Genuine Standard Yield Toner Cartridge, TN630, Replacement Black Toner, Page Yield Up to 1,200 Pages, Amazon Dash Replenishment Cartridge",39.98,17,,1,Office Products,815,4.7,9220,1.4 Pounds,‎1 x 1 x 1 inches,0,2,No,Black, ,Brother toner cartridge,Black, , ,,
B0CFVKJNH1,PACITEK,"910XL Black Ink Compatible with HP 910xl Black Ink 910 XL Black Ink cartridges for hp Printers Work with HP OfficeJet Pro 8020 8025 8025e 8035 8028 8022 8015 8018 Printer,high Yield 2 Pack",29.99,24,,1,Electronics,42721,4.1,42,7 ounces, ,0,2,No,Black, ,"8010, 8010e, 8012e, 8014e, 8015, 8015e, 8018, 8022, 8022e; HP OfficeJet Pro 8020, 8020e, 8024e, 8025, 8025e, 8028, 8028e, 8035, 8035e See more", ,Black, ,,
B0CM31P2DT,UTEFUL,"962XL Ink Cartridges Combo Pack High-Yield Replacement for HP 962 Ink Cartridges (Black,Cyan,Magenta,Yellow,4-Pack) Work with HP OfficeJet Pro 9010 9012 9015 9016 9018 9020 9025 Printer 01", ,23,,,Electronics,0,3.4,167, , ,0,0,No,UTEFUL, ,1600, ,Compatible, ,,
B08XZQ8B8V,Canon,"Canon PG-275XL Black Ink Cartridge, Compatible to PIXMA TS3520, TS3522 and TR4720 Printers AMR", ,10,,1,Office Products,0,4.7,5283, , ,0,0,No,Canon, ,400, ,Compatible, ,"Canon PIXMA TS3520, Canon PIXMA TR4720",
B0722C491T,HP,"HP 64XL Tri-color High-yield Ink Cartridge | Works with HP ENVY Inspire 7950e; ENVY Photo 6200, 7100, 7800; Tango Series | Eligible for Instant Ink | N9J91AN",55.89,19,,3,Office Products,108,4.7,17360,1.6 ounces,4 x 1 x 10 inches,0,0,No,HP, ,415, ,OEM, ,"HP ENVY Photo 7864, HP ENVY Photo 7830, HP OfficeJet 2624, HP ENVY Photo 7855, HP ENVY Photo 7858",
B07DB8QN28,Printers Jack,"Printers Jack 400ML Sublimation Ink for Epson C88 C88+ WF7720 ET2720 ET4760 ET2760 ET2750 WF7820 Inkjet Printers Heat Press Transfer on Mugs, Plates, Polyester Shirts, Phone Cases etc 4 Colors Sublimation Ink",16.99,23,,4,Office Products,4276,4.7,14075,0.4 Kilograms,‎6.38 x 4.25 x 3.5 inches,0,2,No,Inkjet, ,4 Colors Sublimation Ink, ,0.4 Kilograms, ,"Banner paper, Fabric",
B0CH3CFZD9,Smart Ink,Smart Ink Compatible Ink Cartridge Replacement for HP 564 XL 564XL High Yield (4 Combo Pack) for DeskJet 3520 3522 Photosmart 7520 6520 5520 7525 5514 7510 OfficeJet 4620 Printers,13.29,22,,,Electronics,16757,4.4,83,7.4 ounces, ,0,2,No,"Yellow, Cyan, Black, Magenta", ,Printer, , , ,,
B00L1G7OMO,HP,"HP 62XL Tri-color High-yield Ink | Works with HP ENVY 5540, 5640, 5660, 7640 Series, HP OfficeJet 5740, 8040 Series, HP OfficeJet Mobile 200, 250 Series | Eligible for Instant Ink | C2P07AN",45,21,,,Office Products,437,4.7,16450,‎2.08 ounces,‎4 x 1 x 10 inches,0,0,No,HP, ,415, ,OEM, ,"HP ENVY 8005e, HP ENVY 8005, HP ENVY 8000, HP ENVY 7645e, HP OfficeJet 5743, HP OfficeJet 5744, HP OfficeJet 5745, HP OfficeJet 5746, HP OfficeJet 200, HP ENVY 5549, HP OfficeJet 5740, HP ENVY 5548, HP OfficeJet 5741, HP OfficeJet 5742, HP ENVY 5644, HP ENVY 5545, HP ENVY 5665, HP ENVY 5643, HP ENVY 5544, HP ENVY 7645, HP ENVY 5646, HP ENVY 5547, HP ENVY 5546, HP ENVY 7643, HP ENVY 5662, HP ENVY 5640, HP ENVY 5541, HP ENVY 7644, HP ENVY 5661, HP ENVY 5540, HP ENVY 5664, HP ENVY 5642, HP ENVY 5543, HP ENVY 5663, HP ENVY 5542, HP OfficeJet 8040, HP ENVY 7640, HP ENVY 7640e, HP ENVY 5660, HP OfficeJet 635, HP OfficeJet 8045, HP OfficeJet 258, HP OfficeJet 252, HP OfficeJet 6301, HP OfficeJet 250, HP ENVY 8000e See more",
B08ZJ13N9S,Ankink,Ankink Remanufactured Ink Cartridge Replacement for HP Ink 63 63XL (Black and Color 2-Pack) Work with 3830 4650 4652 4655 5200 5252 5255 5258 4520 4512 1112 2132 3630 3632 Printers BK Tricolor,34.99,26,,,Electronics,2198,4.4,3460,3.84 ounces,4.13 x 3.94 x 2.36 inches,2,2,yes,Ankink, ,720, ,Remanufactured, ,"HP OfficeJet 3830, HP OfficeJet 4650, HP OfficeJet 5200, HP Envy 4520, HP OfficeJet 5258",
B0BB6893LL,Relcolor,Compatible Ink Cartridge Replacement for Canon 245XL 246XL (Black Color 2 Pack) 245 246 XL PG245 CL246 MX490 MG2522 MX492 TR4520 TR4500 MG2520 TS3300 TS3322 MG2525 TR4522 TS3100 TS3122 TS3320,34.99,24,,,Electronics,2834,4.4,830,1.76 ounces,4.33 x 1.57 x 3.15 inches,1,2,No,Black Color, ,Printer, ,Black Color, ,,
B07W69W11Z,Canon,"Canon PG-260Xl Black Ink Cartridge, Compatible to Printer TR7020, TS6420, and TS5320",31.99,9,,,Office Products,1121,4.7,2776,‎2.01 ounces,‎1 x 1 x 1 inches,0,0,No,Canon, ,100, ,Compatible, ,"Canon PIXMA TR7020, Canon PIXMA TR6420A, Canon PIXMA TS6420, Canon PIXMA TS5320, Canon PIXMA TS7020A, Canon PIXMA TS6420A, Canon PIXMA TR7020A See more",
B0BB2K5GFW,GZBCKJ,"QY6-0083 Color Printhead, Canon Printhead Replacement for Canon MG7180 iP8720 iP8750 iP8780 7110 MG7520",40.99,13,1,,Electronics,65183,3.5,16,3.2 ounces, ,0,2,No,GZBCKJ, ,Printer, ,Multicolor, ,,
B07FTDNZLZ,BETCKEY,"BETCKEY - Compatible DYMO 30323 (2-1/8"" x 4"") Shipping/Name Badge Labels, Strong Adhesive & Perforated, Compatible with DYMO Labelwriter 450, 4XL, Rollo & Zebra Desktop Printers [16 Rolls/3840 Labels] 16-rolls (3840 Labels)",36.9,21,1,2,Office Products,27140,4.6,254,‎4.85 pounds,‎11.14 x 5.67 x 4.76 inches,0,2,No,"2-1/8"" x 4""", ,BETCKEY, , , ,,
B00L1G7OMO,HP,"HP 62XL Tri-color High-yield Ink | Works with HP ENVY 5540, 5640, 5660, 7640 Series, HP OfficeJet 5740, 8040 Series, HP OfficeJet Mobile 200, 250 Series | Eligible for Instant Ink | C2P07AN",45,21,,,Office Products,437,4.7,16450,‎2.08 ounces,‎4 x 1 x 10 inches,0,0,No,HP, ,415, ,OEM, ,"HP ENVY 8005e, HP ENVY 8005, HP ENVY 8000, HP ENVY 7645e, HP OfficeJet 5743, HP OfficeJet 5744, HP OfficeJet 5745, HP OfficeJet 5746, HP OfficeJet 200, HP ENVY 5549, HP OfficeJet 5740, HP ENVY 5548, HP OfficeJet 5741, HP OfficeJet 5742, HP ENVY 5644, HP ENVY 5545, HP ENVY 5665, HP ENVY 5643, HP ENVY 5544, HP ENVY 7645, HP ENVY 5646, HP ENVY 5547, HP ENVY 5546, HP ENVY 7643, HP ENVY 5662, HP ENVY 5640, HP ENVY 5541, HP ENVY 7644, HP ENVY 5661, HP ENVY 5540, HP ENVY 5664, HP ENVY 5642, HP ENVY 5543, HP ENVY 5663, HP ENVY 5542, HP OfficeJet 8040, HP ENVY 7640, HP ENVY 7640e, HP ENVY 5660, HP OfficeJet 635, HP OfficeJet 8045, HP OfficeJet 258, HP OfficeJet 252, HP OfficeJet 6301, HP OfficeJet 250, HP ENVY 8000e See more",
B0CRLB559N,BKBKC,"245XL 246XL Ink Cartridges Combo Pack for Canon Ink 245 and 246 Remanufactured for Canon PG-245XL CL-246XL for Canon Pixma MX492 TR4520 MG2522 TS3322 MG2500 TR4520 Printer (1Black, Tri-Color)",44.99,21,1,,Electronics,17437,4.9,16,3.84 ounces,3.1 x 3.1 x 2.8 inches,0,2,No,"1Black, Tri-Color", ,Compatible Printers: PIXMA TR SERIES: Pixma TR4520 TR4522 TS3120 TS3122 TS3320 Pixma MX490 MX492 Printer. See more, , , ,,
