Asin,Brand,Title,price,keywords,protection_plans,variants,categories,Bestsellers_rank,Rating,Ratings_total,weight,Dimensions,Bundles,Frequently_bought_together,Newer_model,Connectivity_Technology,Printing_Technology,Special_Feature,Color,Printer_Output,Maximum_Print_Speed_Color,Max_Printspeed_Monochrome,Controller_Type
B0CFM82NS2,HP,"HP OfficeJet Pro 9125e Wireless All-in-One Color Inkjet Printer, Print, scan, Copy, fax, ADF, Duplex Printing Best-for-Office, 3 Months of Ink Included (403X0A)",249.99,16,3,,Electronics,2431,3.4,73,20.5 Pounds,13.48 x 17.3 x 10.94 inches,0,2,No,802.11a/b/g/n/ac 1x1 (2.4/5GHz) with BLE,HP Thermal Inkjet,"Forest First product with HP+; Recyclable through HP Planet Partners, HP+; HP Instant Ink eligible; Print from phone or tablet; Touchscreen; Smart Advance Scan; Instant Paper; Front USB flash drive port; Two-sided printing; Two-sided scanning; Automatic document feeder; Fax See more",Cement,Color,18 ppm,22 ppm,
B08XZQVWZW,Canon,"Canon PIXMA G620 Wireless MegaTank Photo All-in-One Printer [Print, Copy, Scan], Black,Works with Alexa",299,15,3,,Electronics,9820,4.4,560,18 Pounds,17.6 x 19.1 x 10.1 inches,0,2,No,"Wi-Fi, USB",Inkjet,wireless,Black,Color,3.9 ppm,3.9,
B09ZVPQXSN,HP,HP Laserjet-Tank 2504dw Wireless Black & White Monochrome Printer Prefilled with Up to 2 Years of Original HP-Toner (2R7F4A) New version,149.99,13,3,2,Electronics,20933,3.9,1132,13.7 Pounds,"11.2""D x 13.7""W x 8.46""H",0,0,No,Wi-Fi,Laser,Energy Star,white,Monochrome, ,13.7 Pounds,
B09TRZLPXP,Canon,"Canon PIXMA TR8620a - All-in-One Printer Home Office|Copier|Scanner|Fax|Auto Document Feeder | Photo, Document | Airprint (R), Android, Black, Works with Alexa",179,17,3,7,Electronics,1062,4.2,3566,17.4 Pounds,13.8 x 17.3 x 7.5 inches,0,0,No,wireless,Inkjet,"Network-Ready, Auto Document Feeder, Touch Screen, Memory Card Slot",Black,Color,10 ppm,15,
B07X6WFH4B,Epson,"Epson Workforce WF-110 Wireless Color Mobile Printer,White, Small,Black Printer WorkForce WF-110 - New", ,10,,4,Electronics,13514,4.3,756,4.6 Pounds,9.1 x 12.2 x 8.5 inches,0,0,No,Wi-Fi,Inkjet,Portable,Black,Color,3.8 ppm,6.7 ppm,
B0BZH2CCSH,Ofeace,"Sticker Printer, Mini Printer Portable Thermal Printer Inkless Pocket Printer Bluetooth Photo Printer for Learning Assistance, Study Notes, Journal, Fun, Work (Black)",19.99,20,,1,Electronics,260472,4,46,0.24 Kilograms,"7""D x 9.51""W x 10.5""H",0,2,No,Bluetooth,Thermal,Portable,black,Monochrome, ,0.24 Kilograms,
B010J0OQBO,Gold Coast Dynamics,"12 PACK SP-700 Ribbon Ink Cartridge Quality BLACK and RED Compatible with STAR Printer RC-700BR, SP700, 712, 742",19.95,12,,1,Electronics,26272,4.6,443,1.01 pounds,5.23 x 0.68 x 2.63 inches,0,2,No,Black and Red, ,Printer, ,Black, ,,
B092Y1HZKK,Brother,Brother LC406XLBK High Yield Black Ink Cartridge,58.98,6,,1,Office Products,2586,4.6,578,7.2 ounces,1 x 1 x 1 inches,0,0,No,Brother, ,High Yield,Black, , ,,
B0CNT2F47B,EaseFusion,212XL Ink Cartridges Combo Pack [Nov. Upgrade Firmware] Remanufactured Replacement for Epson Printer Ink 212XL 212 XL T212XL for Workforce WF-2850 WF-2830 Expression XP-4105 XP-4100 Printer(5 Pack),29.99,21,,,Electronics,0,3.8,4, , ,0,2,No,EaseFusion, ,600, ,Remanufactured, ,Water,
B0764NWFP9,Brother,"Brother Monochrome Laser HLl2390DW, Wireless Networking, Duplex Printing Refresh Subscription with Free Trial and Amazon Dash Replenishment Read New Model: HLL2390DW",189.98,17,3,3,Electronics,5661,4.5,5684,22.7 Pounds,16.1 x 15.7 x 10.7 inches,0,2,No,"Wi-Fi, USB, Ethernet",Laser,Auto-Duplex,Black/Grey,Monochrome,10,32 ppm,
B0BJ33CJW4,ASprink,"ASprink Bluetooth Shipping Label Printer 4x6 - Wireless Thermal Label Printer for Shipping Packages - Desktop Label Printer for Small Business, Compatible with Chromebook, iPhone, UPS, Shopify White Purple",119.99,21,2,6,Electronics,1138,4.3,1980,3 Pounds,"6.3""D x 8.7""W x 4.4""H",7,2,No,Bluetooth,Thermal,"thermal printing, bluetooth and usb Connection",White Purple,Monochrome, ,3 Pounds,
B079GWK2Q3,Epson,"Epson Expression Home XP-5100 Wireless Color Photo Printer with Scanner & Copier, Amazon Dash Replenishment Ready",116,15,6,,Electronics,100490,4.2,831,12.1 Pounds,19.8 x 14.8 x 7.4 inches,0,2,No,Wi-Fi,Inkjet,Wireless,black,Color,1,1,
B0CLNT35KW,HUIJUTCHEN,"HUIJUTCHEN Mini Sticker Printer - Mini Pocket Printer for iPhone Thermal Printer with 10 Rolls Thermal Paper for Journal, Memo, Photo, Black",27.99,18,,2,Electronics,23733,4.4,44,5.3 Ounces,1.18 x 0.39 x 0.79 inches,0,2,No,Bluetooth,Inkless,Portable,Black,Monochrome,10,10,
B0CH3CFZD9,Smart Ink,Smart Ink Compatible Ink Cartridge Replacement for HP 564 XL 564XL High Yield (4 Combo Pack) for DeskJet 3520 3522 Photosmart 7520 6520 5520 7525 5514 7510 OfficeJet 4620 Printers,13.29,22,,,Electronics,16757,4.4,83,7.4 ounces, ,0,2,No,"Yellow, Cyan, Black, Magenta", ,Printer, , , ,,
B07RJTZ4M6, ,Desktop Thermal Printer Set Up, ,3,,,All Departments,0, , , , ,0,0,No, , , , , , ,,
B07MJ918TJ,Aproca,Aproca Hard Travel Storage Case Fit HP OfficeJet 250 All-in-One Portable Printer Wireless Mobile Printing CZ992A (Black), ,14,,1,All Departments,0,4.4,164, , ,0,2,No,Black, ,Case,Black, , ,,
B0BK93ZSNC,beeprt,"beeprt Bluetooth Shipping Label Printer - Wireless Thermal Label Printer for Shipping Package Small Business, 4x6 Label Printer Compatible with Shopify Ebey Amazon Etsy FedEx UPS USPS",119.99,23,2,,Electronics,24628,4,257,2 Pounds,5.16 x 8.39 x 6.85 inches,4,2,No,Bluetooth,Thermal,"Wireless,Portable",black,Monochrome,72 ppm,72 ppm,
B00WR23WE0,HP,"HP 63 Tri-color Ink Cartridge | Works with HP DeskJet 1112, 2130, 3630 Series; HP ENVY 4510, 4520 Series; HP OfficeJet 3830, 4650, 5200 Series | Eligible for Instant Ink | F6U61AN",33.89,21,,2,Office Products,325,4.7,42490,‎1.6 ounces,‎4 x 1 x 10 inches,0,0,No,HP, ,150, ,OEM, ,"HP OfficeJet 3830, HP OfficeJet 5255, HP OfficeJet 4650, HP DeskJet 3637, HP Envy 4520",
B08XBKYF4W,Printers Jack,Printers Jack 440ml Sublimation Ink for EcoTank Supertank Inkjet Printer ET-2400 ET-2720 ET-2760 ET-2800 ET-2803 ET-2830 ET-4800 ET-3760 ET-2850 ET-7720 /Upgrade Version/Offer Free ICC Printing 440ml Multicolor,32.99,22,,4,Electronics,10468,4.8,304,‎1.39 pounds, ,0,2,No,"Yellow, Cyan, Black, Magenta", ,Refill Ink, , , ,,
B096N7TXR1,Epson,"Epson EcoTank ET-3850 Wireless Color All-in-One Cartridge-Free Supertank Printer with Scanner, Copier, ADF and Ethernet – The Perfect Printer Home Office,White ET-3850 Printer",369,18,3,8,Electronics,2725,4.2,1275,19.1 Pounds,14.8 x 19.8 x 7.4 inches,0,2,No,"Wi-Fi, USB",Inkjet,"Refillable Ink Tank, Auto Document Feeder, Auto 2-sided Printing, Mobile Printing Capability",White,Color,8.5 ppm,15.5,
B01644VWZM,HP,"HP 62 Black/Tri-color Ink (2-pack) | Works with HP ENVY 5540, 5640, 5660, 7640 Series, HP OfficeJet 5740, 8040 Series, HP OfficeJet Mobile 200, 250 Series | Eligible for Instant Ink | N9H64FN",43.89,20,,,Office Products,78,4.7,25114,‎3.2 ounces,‎1.86 x 4.82 x 6.44 inches,0,0,No,HP, ,200, ,OEM, ,"HP OfficeJet 252C, HP OfficeJet 5743, HP OfficeJet 5744, HP OfficeJet 5745, HP OfficeJet 5746, HP OfficeJet 200, HP ENVY 5549, HP OfficeJet 5740, HP ENVY 5548, HP OfficeJet 5741, HP OfficeJet 5742, HP ENVY 5644, HP ENVY 5545, HP ENVY 5665, HP ENVY 5643, HP ENVY 5544, HP ENVY 7645, HP ENVY 5547, HP ENVY 5640, HP ENVY 5541, HP ENVY 5661, HP ENVY 5540, HP ENVY 5664, HP ENVY 5642, HP ENVY 5543, HP ENVY 5663, HP ENVY 5542, HP OfficeJet 8040, HP ENVY 7640, HP ENVY 5660, HP OfficeJet 258, HP OfficeJet 252, HP OfficeJet 250 See more",
 , , , , ,,, ,0, , , , ,0,0,No, , , , , , ,,
B0BBP1N7JC,HP,"HP DeskJet 2734e Wireless Color All-in-One Printer with 3 Months Free Ink (26K72A), White", ,11,,,Electronics,20433,4.2,2815,6.1 Pounds,40 x 47 x 23 inches,0,0,No,"Bluetooth, Wi-Fi, USB",Inkjet,Scanning,White,Color,5.5 ppm,7.5,
B0CHJC8KCR,Kimveway,"61XL Ink Cartridges High Yield Replacement for HP 61 61XL Black and Color Combo Pack for HP DeskJet 1000, 1010, 1050, 2050, 3510; Envy 4500, 5530; for Office Jet 2620, 4630 Printer Ink Cartridges",31.29,24,,1,Electronics,50898,4.1,13,3.84 ounces,4.3 x 1.5 x 2.5 inches,0,2,No,Kimveway, ,620, ,Remanufactured, ,"Deskjet 2546, 2547, 3000, 3050, 3051,, 3052, 3054, 3056, 3510, 3511, 3512, 2514, 2540, 2541, 2542, 2543 2544,, 1000, 1010, 1012, 1050, 1051, 1055, 1056,, 1510, 1512, 1514, 1051, 2050, 2510, 2512, See more",
B09M6X53RK,Canon,"Canon All-in-One Color Inkjet Wired Printer, Print Scan Copy for Home Office, up to 60 Sheets, 600 x 1200 dpi, Portability, Lightweight, PIXMA MG2522, w/USB Cable",58.99,19,3,,Electronics,0,3.9,242,4.42 Kilograms,"14.6""D x 18""W x 7.6""H",0,2,No,USB,Inkjet,Lightweight, , , ,"14.6""D x 18""W x 7.6""H",
B0B52F3L9G,Epson,"Epson EcoTank ET-28 Series Wireless Color All-in-One Cartridge-Free Supertank Inkjet Printer with Scan and Copy, Bluetooth, WiFi, AirPrint, Photo Printing, Bundle with USB Cable (Black)",299,23,3,1,Electronics,151973,5,4,20 pounds,"14.8""D x 22.8""W x 10""H",0,2,No,"Bluetooth, USB, Ethernet",Inkjet,"Bluetooth,Wireless",Black,Color,5 ppm,10 ppm,
B08VF3XRQ8,HP,"HP Laserjet M209dw Wireless Printer, Fast Speeds, Mobile Print, 2 mos Free Toner with Instant Ink, Best for Small Teams (6GW62F)",119,16,3,,Electronics,0,4.3,288,12.4 Pounds,"11""D x 14""W x 8.1""H",0,0,No,Wi-Fi,Laser,"Auto-Duplex, Network-Ready, Energy Star Certified, Cloud Print Enabled, Works with Alexa",Gray,Monochrome, ,12.4 Pounds,
B010A7TZ76,Canon,"Canon Pixma MG3620 Wireless All-In-One Color Inkjet Printer with Mobile and Tablet Printing, Black Black Printer",54,13,3,8,Electronics,673,4.1,25759,11.9 Pounds,12 x 17.7 x 6 inches,0,0,No,wireless,Inkjet,All-in-One Wireless Inkjet Printer,Black,Color,5.7 ppm,9.9 ppm,
B0B2F4P786,HP,"HP LaserJet Pro 4001n Printer, Print, Fast speeds, Easy setup, Mobile printing, Advanced security, Best for small teams, Ethernet/USB only",198,17,3,,Electronics,12330,3.8,66,18.1 Pounds,"14.06""D x 15""W x 8.5""H",0,2,No,"USB, Ethernet",Laser,"Dual Paper Tray, HP Pro Wolf Security, Works with Alexa",white,Monochrome, ,18.1 Pounds,
B0CG1BD6H2,Simple Trending,"3 Tier Mobile Wooden Printer Stand, Multi-Purpose Office Organizer for Fax Machine, Files, Books, Black",36.97,12,2,,Electronics,30540,4.6,31,10.63 pounds,17 x 11.75 x 29.25 inches,0,2,No,Black, ,Wood,Black, , ,,
B0CJ8YQG5C,Phomemo,"Phomemo M960 Label Maker with Tape,Mini Label Maker Printer,Bluetooth Label Makers,Smartphone Labeler, Easy to Use, for Kids School Item Home Business Office Organized(Rechargeable)-Black",22.99,23,,3,Electronics,67437,4.3,104,11.3 ounces,"4.57""D x 2.17""W x 5.51""H",5,2,No,Bluetooth,Thermal,"Portable,Wireless",Black,Monochrome,1 ppm,10 ppm,
B0CQ7WSGFD,POLONO,"POLONO Genuine Label Printer Case Compatible with P31S Label Maker, Hard Carry Label Printer Case for Labeler Makers & Labeling Tapes, Storage Case for Portable Sticker Printer (Case Only), Black",9.99,27,,3,Office Products,12759,5,6,4.6 ounces, ,0,2,No,Black, ,Case,Black, , ,,
B0B747ZNX1,Ubinki,"Remanufactured Ink Cartridge Replacement for HP 65XL 65 Ink (Black and Color Combo, 2-Pack) HP65 XL HP65XL for 5000 5055 3755 3700 3772 3722 2600 2622 3752 2652 2640 5052 5010 5014 Printer",23.99,25,,,Electronics,6375,4.4,450,3.52 ounces,2.66 x 1.47 x 4.23 inches,0,2,No,Ubinki, ,650, ,"Remanufactured, Compatible", ,,
B07DB8QN28,Printers Jack,"Printers Jack 400ML Sublimation Ink for Epson C88 C88+ WF7720 ET2720 ET4760 ET2760 ET2750 WF7820 Inkjet Printers Heat Press Transfer on Mugs, Plates, Polyester Shirts, Phone Cases etc 4 Colors Sublimation Ink",16.99,23,,4,Office Products,4253,4.7,14075,0.4 Kilograms,‎6.38 x 4.25 x 3.5 inches,0,2,No,Inkjet, ,4 Colors Sublimation Ink, ,0.4 Kilograms, ,"Banner paper, Fabric",
B0BZ3JNGHQ,CKMY,"Compatible Ink Cartridge Replacement for Canon 260 261 PG-260 XL/CL-261 XL, Tri-color, Black, 2 Pack",52.99,9,,,Electronics,12027,4.2,129,4.6 ounces, ,0,2,No,CKMY, ,600, ,"260XL Black, 261XL Color", ,,
B0CHY9FR9T,Ubinki,Remanufactured Ink Cartridge Replacement for HP 61 XL 61XL Combo Pack (2 Black 1 Color 3 Pack) for HP Printer 5530 4500 2540 4630 4501 4502 4635 3050 2542 3512 4632 3510 3050a 2514 2541 Printer,33.99,26,,,Electronics,32497,4.6,46,5.6 ounces, ,0,2,No,Ubinki, ,400, ,"Remanufactured, Compatible", ,,
B01BYKD628,HP,"HP 902XL Black High-yield Ink Cartridge | Works with HP OfficeJet 6950, 6960 Series, HP OfficeJet Pro 6960, 6970 Series | Eligible for Instant Ink | T6M14AN",50.89,17,,4,Office Products,56,4.6,23250,2.88 ounces,1 x 1 x 1 inches,0,0,No,HP, ,750, ,OEM, ,"HP OfficeJet Pro 6975, HP OfficeJet Pro 6974, HP OfficeJet Pro 6970, HP OfficeJet Pro 6968, HP OfficeJet Pro 6978 See more",
B0BB6R11WJ,Axlio,"Axlio PG-240XL/CL-241XL Compatible Ink Cartridges Replacement for Canon 240 241, 240XL 241XL Combo Pack Use to Canon MG3620 TS5120 MG3520 MG2120 MX452 MX512 MX532 Printer (2 Pack)",49.99,20,,,Office Products,4314,4.4,1426,‎5 ounces,‎2.76 x 3.07 x 3.07 inches,0,2,No,Multicolor, ,Printer, ,C0240241, ,,
B00L1G7LBI,HP,"HP 62XL Black High-yield Ink | Works with HP ENVY 5540, 5640, 5660, 7640 Series, HP OfficeJet 5740, 8040 Series, HP OfficeJet Mobile 200, 250 Series | Eligible for Instant Ink | C2P05AN",50.89,21,,3,Office Products,129,4.7,26783,‎1.76 ounces,‎4 x 1 x 10 inches,0,0,No,HP, ,600, ,OEM, ,"HP ENVY 8005, HP ENVY 8000, HP OfficeJet 5743, HP OfficeJet 5744, HP OfficeJet 5745, HP OfficeJet 5746, HP OfficeJet 200, HP ENVY 5549, HP OfficeJet 5740, HP ENVY 5548, HP OfficeJet 5741, HP OfficeJet 5742, HP ENVY 5644, HP ENVY 5545, HP ENVY 5665, HP ENVY 5643, HP ENVY 5544, HP ENVY 7645, HP ENVY 5646, HP ENVY 5547, HP ENVY 5546, HP ENVY 5640, HP ENVY 5541, HP ENVY 7644, HP ENVY 5661, HP ENVY 5540, HP ENVY 5664, HP ENVY 5642, HP ENVY 5543, HP ENVY 5663, HP ENVY 5542, HP OfficeJet 8040, HP ENVY 7640, HP ENVY 5660, HP OfficeJet 8045, HP OfficeJet 6301, HP OfficeJet 250 See more",
B09CDWL8JD,Brother,Brother Genuine LC401BK Standard Yield Black Ink Cartridge,13.99,7,,,Office Products,1022,4.6,1071,‎1.6 ounces,‎5.6 x 1 x 3.6 inches,0,0,No,Brother, ,200, ,Black, ,,
B0B1M28FBM,Epson,"Epson EcoTank ET-3850 Wireless Color All-in-One Cartridge-Free Supertank Printer with Scanner, Copier, ADF and Ethernet – White (Renewed) ET-3850 (Renewed) Printer",199.99,15,,8,Electronics,2725,4.2,1275,14.8 Pounds,19.8 x 16.4 x 10 inches,0,0,No,"Wi-Fi, USB, Ethernet",Inkjet,"Auto-Duplex, Energy Star, Refillable Ink Tank, Auto Document Feeder",White,Color,8.5 ppm,15.5 ppm,
B01IIOMNIG,Canon,"Canon Office Products MAXIFY MB2120 Wireless Color Photo Printer with Scanner, Copier and Fax Printer Only",158.66,12,3,2,All Departments,0,4.2,872,23.2 Pounds, ,0,2,No,USB,Inkjet,Wireless,Black,Color,1 ppm,1 ppm,
B09CDV5BFT,Brother,Brother Genuine LC401XL 2PK High Yield 2-Pack Black Ink Cartridges,54.98,8,,1,Office Products,3416,4.6,483,‎3.2 ounces,‎1.97 x 3.74 x 4.53 inches,0,0,No,Brother, ,500, ,OEM, ,,
B096N85ZHW,Epson,"Epson EcoTank ET-2850 Wireless Color All-in-One Cartridge-Free Supertank Printer with Scan, Copy and Auto 2-Sided Printing - White, Medium White ET-2850 (White) Print/Copy/Scan",262.99,17,6,11,Electronics,1180,4.3,4309,11.9 Pounds,14.8 x 22.3 x 10.2 inches,0,2,No,"Wi-Fi, USB",Inkjet,"Refillable Ink Tank, Auto 2-sided Printing",White,Color,5 ppm,10.5,
B07W69W11Z,Canon,"Canon PG-260Xl Black Ink Cartridge, Compatible to Printer TR7020, TS6420, and TS5320",31.99,9,,,Office Products,1123,4.7,2776,‎2.01 ounces,‎1 x 1 x 1 inches,0,0,No,Canon, ,100, ,Compatible, ,"Canon PIXMA TR7020, Canon PIXMA TR6420A, Canon PIXMA TS6420, Canon PIXMA TS5320, Canon PIXMA TS7020A, Canon PIXMA TS6420A, Canon PIXMA TR7020A See more",
B003YT6RNS,HP,"HP 61 Black/Tri-color Ink (2 Count - pack) | Works with DeskJet 1000, 1010, 1050, 1510, 2050, 2510, 2540, 3000, 3050, 3510; ENVY 4500, 5530; OfficeJet 2620, 4630 | Eligible for Instant Ink | CR259FN",54.89,25,,,Office Products,198,4.7,36791,‎1.6 ounces,‎5 x 16.2 x 12.5 inches,0,0,No,HP, ,170, ,OEM, ,"HP ENVY 4507, HP ENVY 4508, HP ENVY 4509, HP ENVY 4505, HP ENVY 4506",
B0C81DZTX4,Aixiqee,"Portable Printer Wireless for Travel，Bluetooth Thermal Printer Support 8.5"" X 11"" US Letter &Legal, A4&A5 Thermal Paper, Inkless Printer Compatible with iOS, Android & Laptop for Office Car Home",129.73,21,3,,Office Products,1313,4.4,479,2 Pounds,"3.94""D x 12.2""W x 4.84""H",0,2,No,🏆TOP Seller,Thermal,Portable,BLACK,Monochrome, ,2 Pounds,
B0CGWCZV4N,FasionMior,"Sticker Printer Machine- Mini Thermal Printer, Inkless Notes Printer Mini, Portable Bluetooth Pocket Phone Printer for Journal, Photos, Notes, Kids Gift, Pink Mini Printer Sticker Maker",17.99,25,,3,Electronics,64568,4.3,25,7.8 ounces,"2""D x 3""W x 3""H",0,2,No,Bluetooth,Thermal,"Bluetooth,Portable",Pink,Monochrome, ,"2""D x 3""W x 3""H",
B0BTTGHZ4M,TOKYOINK,TOKYOINK 63XL Ink Cartridges Black and Color Combo Pack Remanufactured Replacement for HP 63 63XL Ink Compatible with HP Envy 4520 4512 OfficeJet 3830 4650 5258 5255 4652 4655 Deskjet 2130 Printer,22.98,25,,,Electronics,55321,4.1,85,6.4 ounces,3.34 x 2.95 x 2.95 inches,0,2,No,TOKYOINK, ,380, ,"OEM, Remanufactured, Compatible", ,"HP ENVY 4522, HP ENVY 4523, HP ENVY 4524, HP OfficeJet 3833, HP OfficeJet 3834, HP ENVY 4520, HP DeskJet Ink Advantage 3635, HP DeskJet 1110, HP DeskJet 3631, HP OfficeJet 4654, HP DeskJet 1112, HP DeskJet 3630, HP OfficeJet 4655, HP DeskJet 3632, HP OfficeJet 5200, HP Deskjet 3633, HP OfficeJet 4650, HP DeskJet 3634, HP ENVY 4516, HP OfficeJet 4652, HP ENVY 4517, HP DeskJet 3636, HP ENVY 4510, HP ENVY 4511, HP ENVY 4512, HP ENVY 4513, HP OfficeJet 4658, HP DeskJet Ink Advantage 2136, HP DeskJet 2131, HP DeskJet 2130, HP DeskJet 2132, HP DeskJet 2134, HP OfficeJet 3830, HP OfficeJet 3831, HP OfficeJet 3832, HP OfficeJet 5255, HP ENVY 4525, HP ENVY 4526, HP ENVY 4527, HP OfficeJet 5258 See more",
B08P3X7LHT,Canon,"Canon PIXMA G1220 Single Function MegaTank Inkjet Printer, Print Only, Black, (4469C002)",167,12,3,,Electronics,202285,3.8,359,10.6 Pounds,13 x 17.6 x 5.4 inches,0,2,yes,USB,Inkjet,wireless,Black,Color,5 ppm,9.1,
B0BVBWCW9X,Rohon,"Rohon 952xl Latest Upgrade Compatible Ink Cartridges Combo Pack Replacement for HP 952 XL Use with Officejet Pro 7740 8210 8710 8720 8740 8715 7720 8725 8730 (4 Packs), Black, Cyan, Yellow, Magenta",39.99,25,,,Electronics,727,4.1,1891,9.9 ounces,1 x 1 x 1 inches,0,2,No,"Black, Cyan, Yellow, Magenta", ,Printer, ,"Black, Cyan, Yellow, Magenta", ,,
B0CGTW59BL,iDPRT,"iDPRT Bluetooth Thermal Label Printer, 4X6 Shipping Label Printer for Small Business and Shipping Packages, Support Windows, Mac, iOS, Android, Used for Amazon, Shopify, Ebay, UPS, USPS Bluetooth+USB Black-Mini",99.99,20,2,3,Electronics,2160,4.2,5007,2.12 pounds,"7.68""D x 6.58""W x 3.62""H",1,2,No,Bluetooth,Thermal,"Portable, No ink No toner, Support iOS, Android, Windows, mac OS, Chrome OS,Linux,Raspberry Pi, Auto Decetion, High-speed Printing See more",Black-Mini,Monochrome, ,"7.68""D x 6.58""W x 3.62""H",
B0CQN8Q237,HuiJuKeJi,"HuiJuKeJi Mini Sticker Printer Cat Bluetooth Smart Pocket Inkless Thermal Printer with 7 Rolls Thermal Paper and Sticker for iOS&Android, Portable Receipt Printer for Photo Journal Notes Memo - Pink",23.99,24,,2,Electronics,145063,4.3,8,13.7 ounces,"1""D x 1""W x 1""H",0,2,No,Bluetooth,"Thermal, APP, Inkless",mini pocket Thermal Printer with 7 Rolls Thermal Paper,Pink,Color,1,1,
B0CGCS8RWJ,Brother,"Brother Print & Cut MFC-J1800DW Wireless Color All-in-One Inkjet Printer with Automatic Paper Cutter | Includes 4 Month Refresh Subscription Trial(1), Amazon Dash Replenishment Ready",199.99,21,3,,Electronics,56433,4.4,26,18 Pounds,13.5 x 15.7 x 6.8 inches,0,2,No,"Wi-Fi, USB",Inkjet,"Auto-Duplex, Energy Star, Display Screen, Auto Document Feeder",White,Color,16.5 ppm,17 ppm,
B00TRBZGHU,Laser Tek Services,Laser Tek Services Atrix Omega Toner Printer Electronics Service Vacuum,320.99,9,2,,Home & Kitchen,463524,5,2,11.73 pounds,8 x 8 x 8 inches,0,0,No,Portable, ,Handheld, , , ,,
B0CL8TSB7L,PRINHSJI,"Mini Sticker Thermal Printer, Bluetooth Inkless Pocket Printer Compatible with iOS & Android,Portable Receipt Printer for Photo Notes Memo Pink",22.77,17,,4,Electronics,73021,3.7,17,416.6 Grams,3.24 x 3.24 x 1.57 inches,0,2,No,Bluetooth,"Mini,Portable",Portable,Pink,Monochrome,35 ppm,35 ppm,
B0CFM7BTW8,HP,"HP OfficeJet Pro 8135e Wireless All-in-One Color Inkjet Printer, Print, scan, Copy, fax, ADF, Duplex Printing Best-for-Home-Office, 3 Months of Ink Included (40Q35A)",169.99,16,3,,Electronics,1795,3.3,81,17.6 Pounds,13.29 x 18.12 x 9.17 inches,0,2,No,802.11a/b/g/n/ac 1x1 (2.4/5GHz) with BLE,Inkjet,"Forest First product with HP+; FSC Certified Packaging; Contains ocean-bound recycled plastic; 45% post-consumer recycled plastic; Recyclable through HP Planet Partners, HP Instant Ink eligible; Automatic document feeder; Touchscreen; Quiet mode; Print over VPN with HP+ See more",Light Cement,Color,10 ppm,20 ppm,
B07FN78LY5,Brother,Brother HL-L3290CDW Wireless Color Laser Printer New Model: HLL3290CDW,369.98,6,3,1,Electronics,11061,4.2,2771,47.8 Pounds,18.7 x 16.1 x 14.5 inches,0,2,No,wireless,Laser,wireless,White,Color,25 ppm,25 ppm,
B01BYKB774,HP,"HP 902 Black Ink Cartridge | Works with HP OfficeJet 6950, 6960 Series, HP OfficeJet Pro 6960, 6970 Series | Eligible for Instant Ink | T6L98AN",21.89,15,,,Office Products,590,4.6,11086,‎1.12 ounces,‎1 x 1 x 1 inches,0,0,No,HP, ,300, ,OEM, ,HP OfficeJet Pro 6968,
B0B6TZT6B8,Ubinki,"Compatible Ink Cartridge Replacement for Canon 245XL 246XL (Black Color,2-Pack) 245 246 PG245 CL246 XL to MX490 TR4520 TS3322 TR4522 TR4500 TS3122 TS3300 MX492 MG2522 TS3320 TS3100 Printer",29.49,23,,,Electronics,2865,4.5,1151,2.39 ounces,1.47 x 4.23 x 3.05 inches,0,2,No,Ubinki, ,600, ,"OEM, Remanufactured, Compatible", ,"Canon PIXMA MG3020, Canon PIXMA TR4522, Canon PIXMA TR4500, Canon PIXMA MG3022, Canon PIXMA TR4520, Canon PIXMA MX492, Canon PIXMA MG2555, Canon PIXMA MG3029, Canon PIXMA MX490, Canon PIXMA MG2924, Canon PIXMA TS3300, Canon PIXMA TS3322, Canon PIXMA TS3120, Canon PIXMA TS3122, Canon PIXMA TS3100, Canon PIXMA TS3320, Canon PIXMA MG2520, Canon PIXMA MG2420, Canon PIXMA MG2522, Canon PIXMA MG2500, Canon PIXMA MG2920, Canon PIXMA MG2922, Canon PIXMA MG2525, Canon PIXMA TS302, Canon PIXMA TS202, Canon PIXMA TR4527, Canon PIXMA iP2820 See more",
B0BVXMBJGH,HP,"HP Color LaserJet Pro 4201dw Wireless Printer, Print, Fast speeds, Easy setup, Mobile printing, Advanced security, Best-for-small teams, Works with Alexa New version",419,19,3,2,Electronics,18070,4.2,1299,17.92 pounds,"16.6""D x 11.3""W x 16.8""H",0,2,No,USB,Laser,"Compact, Works with Alexa",white,Color,33 ppm,35 ppm,
B0CKXJGBT3,POLONO,"POLONO P31S Label Maker Machine with Tape, Portable Thermal Printer, Portable Bluetooth Label Printer for Organizing Storage Office Home, Sticker Maker Mini Label Maker with Multiple Templates, White",29.99,27,,5,Electronics,409,4.7,130,‎7.8 ounces,"1.89""D x 4.5""W x 6.5""H",13,2,No,Bluetooth,Thermal,"Portable, Clear Printing, Easy to Use, Rechargeable, Wireless, Inkless, Text, QR code, Barcode, Materials, Images, Time and Borders See more",White,Monochrome, ,"1.89""D x 4.5""W x 6.5""H",
B0CRRXBH19,Grathia,"Portable Thermal Printer Wireless Travel, Bluetooth Printer for Phone, Support 8.3""*11.6"" US Letter,Compact Inkless Printer for School,Home",65.99,16,2,,Electronics,132230,2.8,6,1.43 pounds,"2.3""D x 10.3""W x 0.7""H",0,2,No,Bluetooth,Thermal,Portable,White,Monochrome, ,"2.3""D x 10.3""W x 0.7""H",
B099MLDBKJ,JADENS,"JADENS Bluetooth Thermal Shipping Label Printer – Wireless 4x6 Shipping Label Printer, Compatible with Android&iPhone and Windows, Widely Used for Ebay, Amazon, Shopify, Etsy, USPS",99.99,21,2,3,Electronics,981,4.4,5236,2 Kilograms,"5.91""D x 9.06""W x 5.91""H",5,2,No,"Bluetooth, USB",Thermal,"Bluetooth,Wireless",Blue,72, ,"5.91""D x 9.06""W x 5.91""H",
B08DXBLK14,Epson,"Epson® Workforce® Pro WF-3820 Wireless Color Inkjet All-in-One Printer, Black Large",99.99,10,3,3,Electronics,3399,4,2640,19.4 Pounds,16.7 x 19.4 x 9.8 inches,0,0,No,Wireless,Inkjet,wireless,Black,Color,11 ppm,21 ppm,
B09XQM9PB3,Brother,Brother Monochrome Laser All-in-One MFCL2710DW Value Version (MFCL2717DW) adds 2-Year Warranty MFCL2710DW Value Bundle (MFCL2717DW),219.99,11,3,6,Electronics,1629,4.5,9197,26 Pounds,"15.7""D x 16.1""W x 12.5""H",0,2,No,USB,Laser,"Auto-Duplex, Scan To E-Mail, Network-Ready, Energy Star, Auto Document Feeder",Black/Grey,Monochrome, ,26 Pounds,
B0CNJY5ZNP,VICTONER,TN227 TN-227BK/C/M/Y Toner Cartridge: Compatible Replacement for Brother TN227 TN223 TN 227 for MFC-L3770CDW HL-L3290CDW MFC-L3750CDW HL-L3270CDW HL-L3210CW Printer (TN-223BK/C/M/Y High Yield 5-Pack),72.99,19,,,Electronics,0,4.5,92, , ,0,2,No,TN-227 Black Cyan Magenta Yellow 5 Pack, ,High Yield,TN-227 Black Cyan Magenta Yellow 5 Pack, , ,,
B0763X6TCW,Brother,"Brother MFCL2750DW Monochrome All-in-One Wireless Laser Printer, Duplex Copy & Scan, Includes 4 Month Refresh Subscription Trial and Amazon Dash Replenishment Ready New Model: MFCL2750DW",299.98,19,3,3,Office Products,4333,4.5,4189,26.5 Pounds,"15.7""D x 16.1""W x 12.5""H",0,0,No,"wired, Wi-Fi",Laser,Auto-Duplex,Black,Monochrome, ,26.5 Pounds,
B0C9GP8VMG,SANUNE,"Remanufactured Ink Cartridge Replacement for HP Ink 61 61XL Combo Pack for HP Envy 4500 5530 4502 5535 5534 OfficeJet 4630 4635 Deskjet 1000 1010 1510 1512 2540 Printer (1 Black, 1 Tri-Color)",19.98,24,,,Electronics,20577,4.5,90,4.2 ounces,2.95 x 2.76 x 2.76 inches,0,2,No,SANUNE, ,650, ,"Remanufactured, Compatible", ,"HP ENVY 4500, HP ENVY 5535, HP ENVY 4502, HP ENVY 5530, HP DeskJet 1010, HP DeskJet 2540, HP DeskJet 1000, HP Envy 5534, HP OfficeJet 4635, HP DeskJet 1510, HP DeskJet 1512, HP OfficeJet 4630 See more",
B0BCCMCRY8,HP,"HP Envy Inspire 7958e Wireless Color All-in-One Printer with 6 Months Free Ink with HP+ (327A7A), White",129.99,13,3,3,Electronics,3822,3.9,1004,17.9 Pounds,40 x 47 x 23 inches,0,2,No,Wi-Fi,Inkjet,auto-document feeder,White,"Monochrome, Color",10 ppm,15 ppm,
