Asin,Brand,Title,price,keywords,protection_plans,variants,categories,Bestsellers_rank,Rating,Ratings_total,weight,Dimensions,Bundles,Frequently_bought_together,Newer_model,Connectivity_Technology,Printing_Technology,Special_Feature,Color,Printer_Output,Maximum_Print_Speed_Color,Max_Printspeed_Monochrome,Controller_Type
B0BTKJF469,HuiJuKeJi,"HuiJuKeJi Mini Sticker Printer Bluetooth Smart Pocket Inkless Thermal Printer with 11 Rolls Thermal Paper and Sticker for iOS&Android, Portable Receipt Printer for Photo Journal Notes Memo - Pink",26.99,24,,5,Electronics,0,4.3,1360,210 Grams, ,0,2,No,Bluetooth,"Thermal, APP, Inkless",mini pocket Thermal Printer with 11 Rolls Thermal Paper,Pink,Monochrome,1.00,1.00,
B0CJF7LKX4,HuiJuKeJi,"HuiJuKeJi Inkless Sticker Printer Mini Thermal Printer with 10 Rolls Thermal Paper,Color Pen for iOS&Android, Bluetooth Pocket Printer Smart Portable Receipt Printer for Photo Journal Notes Memo-Blue Blue+9 rolls paper +Colored sticky notes Blue",26.99,24,,5,Electronics,43767,4.3,464,15.2 ounces,"1""D x 1""W x 1""H",0,2,No,Bluetooth,Thermal，inkless，APP,mini inkless sticker printer with 10 rolls paper and 5 pens,Blue,Monochrome and Color,1,1,
B0CSJHBKHF,Q-image,"952XL Ink cartridges Combo Pack for HP 952 XL 952XL Work for HP Officejet Pro 7740 8710 8715 8210 8720 8725 8740 8730 8200 7720 8702 Printer(Black, Cyan, Magenta, Yellow) 4 Packs",49.99,22,,1,Electronics,134836,4.3,113,9.9 ounces,4.8 x 4.1 x 2.8 inches,0,2,No,Q-image, ,2000, ,Compatible, ,7740 8710 8715 8720 8210 7720 8740 8725,
B0CGWCZV4N,FasionMior,"Sticker Printer Machine- Mini Thermal Printer, Inkless Notes Printer Mini, Portable Bluetooth Pocket Phone Printer for Journal, Photos, Notes, Kids Gift, Pink Mini Printer Sticker Maker",17.99,25,,3,Electronics,57448,4.3,25,7.8 ounces,"2""D x 3""W x 3""H",0,2,No,Bluetooth,Thermal,"Bluetooth,Portable",Pink,Monochrome, ,"2""D x 3""W x 3""H",
B0CF9CHLMX,ST-CARE,"Mini Pocket Bluetooth Printer-Portable Thermal Printer with 5 Roll Papers for Journal/DIY Scrapbook/Travel/Notes/Lists/Label/Memo, Receipt Printer for Children Women Gifts Kids Christmas iOS&Android X5-pink",23.99,19,,12,Electronics,20196,4.2,1059,0.54 Pounds,4.6 x 3.8 x 2 inches,0,2,No,Bluetooth,Thermal,Portable,X5-pink,0.54 Pounds, ,"Labels, Glossy photo paper",
B0C6MT1LG2,LabelCreate,"LabelCreate T02 Sticker Printer, 【2024 New Upgrade】 Mini Thermal Printer, Sticker Printer Machine, Bluetooth Wireless Portable Printer for Kids Birthday, New Year Gift 1 Printer + 1 Paper Green",37.49,19,,6,Electronics,103974,4.4,94,8.8 ounces,"3.54""D x 3.42""W x 1.57""H",6,2,No,Bluetooth Sticker Printer for Smartphone & Tablets,T02 Mini Thermal Sticker Printer,"Attention: Bluetooth connection in APP instead of phone setting system! T02 inkless sticker printer, t02 bluetooth mini printer, t02 mini pocket sticker printer, t02 mini pocket sticker printer, t02 portable mini printer sticker maker machine for New Year Gift See more",Green,Monochrome inkless mini printer sticker maker, ,,"A Bluetooth sticker printer compatible with both iOS and Android devices, including iPhones, Android phones, iPads, and Android tablets. See more"
B0CQTGBM8Y,HUIJUTCHEN,"HUIJUTCHEN 10 Rolls Thermal Mini Printer Paper for Inkless Mini Printer, 5 Rolls Thermal Sticky Paper & 5 Rolls Thermal Plain Paper, 57X25mm, for Notes Journal Memo Photo Study",13.99,23,,,Office Products,99513,4.5,8,‎7.4 ounces,"2.24""L x 0.98""W",0,2,No,White, ,Biodegradable,White, , ,,
B0CHM7V6F4,Vicbear,"Vicbear 16 Rolls Mini Thermal Printer Paper, Including 6 Rolls Thermal Sticker Paper & 10 Rolls Thermal Plain Paper for Mini Portable Printers, 57X25mm, Suitable for Various Inkless Sticker Printers",14.95,24,,,Office Products,106122,4.3,10,‎10.8 ounces,‎2.24 x 0.98 x 0.1 inches,0,2,No,White, ,2.24X177; 2.24X118 Inches,White, , ,,
B0CTQ34ZK7,WORTHDO,822XL Remanufactured for Epson 822XL Ink Cartridges for Epson 822 XL for Epson Workforce Pro WF-3820 WF-3823 WF-4820 WF-4830 WF-4833 WF-4834 Printer 2 Black, ,16,,,Electronics,349915,4.1,878,4.2 ounces,1 x 1 x 1 inches,0,0,No,WORTHDO, ,1100, ,Remanufactured, ,,
B0CQ21LGW8,HPRT,"HPRT Thermal Labels for T20 Label Printer, 1.57"" x 1.18""(40x30 mm) Waterproof Sticker Paper, Thermal Tape for HPRT T20/T260 Label Maker, 200 Labels/Roll White-40x30mm",5.99,17,,6,Office Products,15997, , ,‎1.44 ounces, ,0,2,No,Paper, ,Polished, , , ,,
B0C9GL9HNC,Greateam,"Mini Thermal Printer Sticker Paper for Mini Pocket Printer and Bluetooth Mini Inkless Thermal Sticker Printer, 57mm x 30mm Mini Printer Sticker Paper Self-Adhesive, Black on White, 6 Rolls",15.99,24,,2,Office Products,0,4.3,19, , ,0,2,No,Black on White, ,57mm x 30mm Mini Sticker Printer Paper Millimeters,Black on White, , ,,
B0BTTGHZ4M,TOKYOINK,TOKYOINK 63XL Ink Cartridges Black and Color Combo Pack Remanufactured Replacement for HP 63 63XL Ink Compatible with HP Envy 4520 4512 OfficeJet 3830 4650 5258 5255 4652 4655 Deskjet 2130 Printer,22.98,25,,,Electronics,63949,4.1,85,6.4 ounces,3.34 x 2.95 x 2.95 inches,0,2,No,TOKYOINK, ,380, ,"OEM, Remanufactured, Compatible", ,"HP ENVY 4522, HP ENVY 4523, HP ENVY 4524, HP OfficeJet 3833, HP OfficeJet 3834, HP ENVY 4520, HP DeskJet Ink Advantage 3635, HP DeskJet 1110, HP DeskJet 3631, HP OfficeJet 4654, HP DeskJet 1112, HP DeskJet 3630, HP OfficeJet 4655, HP DeskJet 3632, HP OfficeJet 5200, HP Deskjet 3633, HP OfficeJet 4650, HP DeskJet 3634, HP ENVY 4516, HP OfficeJet 4652, HP ENVY 4517, HP DeskJet 3636, HP ENVY 4510, HP ENVY 4511, HP ENVY 4512, HP ENVY 4513, HP OfficeJet 4658, HP DeskJet Ink Advantage 2136, HP DeskJet 2131, HP DeskJet 2130, HP DeskJet 2132, HP DeskJet 2134, HP OfficeJet 3830, HP OfficeJet 3831, HP OfficeJet 3832, HP OfficeJet 5255, HP ENVY 4525, HP ENVY 4526, HP ENVY 4527, HP OfficeJet 5258 See more",
B010J0OQBO,Gold Coast Dynamics,"12 PACK SP-700 Ribbon Ink Cartridge Quality BLACK and RED Compatible with STAR Printer RC-700BR, SP700, 712, 742",19.95,12,,1,Electronics,30423,4.6,443,1.01 pounds,5.23 x 0.68 x 2.63 inches,0,2,No,Black and Red, ,Printer, ,Black, ,,
B08PZ1S5LW, ,The Printer,2.99,1,,2,Kindle Store,0,5,1, , ,0,0,No, , , , , , ,,
B0B741ZK1H,Ubinki,"Remanufactured Ink Cartridge Replacement for HP 65XL 65 Ink (Black,2-Pack) HP65 XL HP65XL for 5000 5055 3755 3700 3772 3722 2600 3752 2652 2655 2622 2640 5052 5010 5070 5014 Printer",23.99,25,,,Electronics,7484,4.4,162,3.52 ounces,2.66 x 1.47 x 4.23 inches,0,2,No,Black, ,Printer, , , ,,
B09CDWL8JD,Brother,Brother Genuine LC401BK Standard Yield Black Ink Cartridge,13.99,7,,,Office Products,1203,4.6,1071,‎1.6 ounces,‎5.6 x 1 x 3.6 inches,0,0,No,Brother, ,200, ,Black, ,,
B08XZQ4ZSN,Canon,"Canon CL-276 Color Ink Cartridge, Compatible to PIXMA TS3520, TS3522 and TR4720 Printers",21,10,,,Office Products,1457,4.6,1584,‎1.6 ounces,‎3.4 x 2.1 x 2 inches,0,2,No,Canon, ,Printer, ,Multi, ,,
B00AH9JVLS,Canon,"Canon PGI-250XL PGBK Compatible to iP7220,iX6820,MG5420,MG5520/MG6420,MG5620/MG6620,MX922/MX722,iP8720,MG6320,MG7120,MG7520 Printers PGI-250XL Black Ink",27,15,,7,All Departments,2224,4.7,5479,1.6 ounces,2.7 x 1.2 x 5.8 inches,0,2,No,Canon, ,500, ,Compatible, ,"Canon PIXMA MG6320, Canon PIXMA MX722, Canon PIXMA MG7120, Canon PIXMA MG6620, Canon PIXMA MG5520, Canon PIXMA MG5620, Canon PIXMA MG5422, Canon PIXMA MG6420, Canon PIXMA MG7520, Canon PIXMA MG5420, Canon PIXMA iX6820, Canon PIXMA iP7220, Canon PIXMA MG5522, Canon PIXMA MG5622, Canon PIXMA MG5600, Canon PIXMA iP8720, Canon PIXMA MX922 See more",
B096BF5DJQ,Filery,"Compatible Ink Cartridges Replacement for Canon 280 281 280XXL 281XXL, Work with PIXMA 20 TR8520 TS6120 TS6220 TS8120 TR7520 Printer, 5 Pack (1 PGBK, 1 Black, 1 Cyan, 1 Magenta, 1 Yellow)",19.99,21,,,Electronics,12789,4.7,906,6.1 ounces, ,0,0,No,"Yellow, Cyan, Black, Magenta", ,Printer, ,"PGBK, Black, Cyan, Magenta, Yellow", ,,
B07X5SKYPD,E-Z Ink,E-Z Ink (TM Compatible Ink Cartridge Replacement for Canon PGI-280XXL PGI 280 XXL Compatible with PIXMA TR7520 TR8520 TS6120 TS6220 TS8120 TS8220 TS9120 TS9520 TS9521C Printer (2 PGBK),16.99,19,,,Office Products,2955,4.7,2652,‎3.84 ounces, ,0,2,yes,E-Z Ink, ,600, ,Compatible, ,"Canon PIXMA TS9520, Canon PIXMA TR7520, Canon PIXMA TR7620, Canon PIXMA TS9100, Canon PIXMA TR7500, Canon PIXMA TS9120, Canon PIXMA TS702, Canon PIXMA TS9521C, Canon PIXMA TS6200, Canon PIXMA TS6320, Canon PIXMA TS6100, Canon PIXMA TS8322, Canon PIXMA TS8300, Canon PIXMA TS6300, Canon PIXMA TR8520, Canon PIXMA TS8320, Canon PIXMA TS8100, Canon PIXMA TR8620, Canon PIXMA TS8222, Canon PIXMA TS8200, Canon PIXMA TR8500, Canon PIXMA TS8120, Canon PIXMA TS6220, Canon PIXMA TR8622, Canon PIXMA TS8220, Canon PIXMA TS6120 See more",
B0016P8Q0Y,HP,"HP 60XL Black High-yield Ink Cartridge | Works with DeskJet D1660, D2500, D2600, D5560, F2400, F4200, F4400, F4580; ENVY 100, 110, 120; PhotoSmart C4600, C4700, D110a Series | CC641WN",65.89,22,,,Office Products,5313,4.7,4590,‎2.24 ounces,‎1.5 x 2.5 x 4.5 inches,0,0,No,HP, ,600, ,OEM, ,"HP ENVY 110-D411a, HP ENVY 110-D411b, HP DeskJet F4293, HP DeskJet F4492, HP DeskJet F4294, HP DeskJet F4250, HP DeskJet F4292, HP DeskJet D2663, HP DeskJet F4210, HP DeskJet F4450, HP DeskJet F4213, HP DeskJet F2476, HP PhotoSmart C4610, HP DeskJet F2430, HP DeskJet D2660, HP DeskJet D1658, HP PhotoSmart C4650, HP ENVY 100, HP DeskJet D2545, HP PhotoSmart C4690, HP ENVY 111-D411d, HP DeskJet F4480, HP DeskJet F4283, HP DeskJet F4280, HP DeskJet F4440, HP PhotoSmart C4700, HP DeskJet F4240, HP DeskJet D5545, HP DeskJet D1620, HP DeskJet F4483, HP DeskJet D1663, HP PhotoSmart C4783, HP ENVY 100-D410b, HP DeskJet F4400, HP DeskJet F2420, HP PhotoSmart C4740, HP ENVY 100-D410a, HP DeskJet F4288, HP DeskJet D1660, HP ENVY 114-D411c, HP PhotoSmart C4780, HP DeskJet F2423, HP DeskJet D1668, HP DeskJet F4470, HP DeskJet F4272, HP DeskJet F4473, HP DeskJet F4275, HP DeskJet F2493, HP PhotoSmart C4799, HP DeskJet D2563, HP PhotoSmart C4635, HP DeskJet F4273, HP DeskJet D2566, HP DeskJet F4472, HP DeskJet F4274, HP DeskJet F4230, HP DeskJet F2492, HP DeskJet D1630, HP PhotoSmart C4750, HP DeskJet F4235, HP DeskJet D2560, HP PhotoSmart C4795, HP DeskJet F2410, HP DeskJet D2680, HP DeskJet F4435, HP ENVY 120, HP DeskJet F4238, HP ENVY 121, HP DeskJet D2645, HP DeskJet D2568, HP DeskJet F2418, HP DeskJet D5560, HP DeskJet F4580, HP PhotoSmart C4600, HP DeskJet F4583, HP DeskJet F2483, HP DeskJet D5568, HP DeskJet D2530, HP DeskJet F2480, HP PhotoSmart D110a, HP PhotoSmart C4640, HP PhotoSmart C4685, HP DeskJet F4500, HP DeskJet F2440, HP DeskJet D5563, HP PhotoSmart C4680, HP DeskJet F2488, HP DeskJet F2400, HP PhotoSmart C4683, HP ENVY 110, HP ENVY 111, HP ENVY 114 See more",
B0C9GP8VMG,SANUNE,"SANUNE Remanufactured Ink Cartridge Replacement for HP Ink 61 61XL Combo Pack for HP Envy 4500 5530 4502 5535 5534 OfficeJet 4630 4635 Deskjet 1000 1010 1510 1512 2540 Printer (1 Black, 1 Tri-Color)",19.98,25,,,Electronics,28284,4.5,90,4.2 ounces,2.95 x 2.76 x 2.76 inches,0,2,No,SANUNE, ,650, ,"Remanufactured, Compatible", ,"HP ENVY 4500, HP ENVY 5535, HP ENVY 4502, HP ENVY 5530, HP DeskJet 1010, HP DeskJet 2540, HP DeskJet 1000, HP Envy 5534, HP OfficeJet 4635, HP DeskJet 1510, HP DeskJet 1512, HP OfficeJet 4630 See more",
B0009WH87M,HP,"HP 22 Tri-color Ink Cartridge | Works with DeskJet D1300, D1400, D1500, D2300, D2400, F300, F2100, F2200, F4100, 3900; OfficeJet J3600, 4315, 5600; PSC 1410; Fax 1250, 3180 Series | C9352AN",37.89,24,,,Office Products,10187,4.7,2649,‎1.28 ounces,‎3.7 x 11.2 x 10.3 inches,0,0,No,HP, ,165, ,OEM, ,"HP OfficeJet J3680, HP DeskJet D1455, HP DeskJet D1341, HP DeskJet D1560",
B0BYZSZQRC,TECKKIN,"65XL Ink Cartridges Black/Color Combo Pack High Yield Replacement for HP Ink 65 65XL for HP DeskJet 3755 3772 3700 3752 3722 2600 2622 2652 Envy 5055 5000 5070 Printer (1 Black,1 Tri-Color)",32.99,25,,,Electronics,1056,4.5,1049,4.4 ounces, ,0,2,yes,TECKKIN, ,1096, ,Remanufactured, ,"HP DeskJet Ink Advantage 2640, HP ENVY 5034, HP ENVY 5012, HP ENVY 5014, HP ENVY 5052, HP ENVY 5030, HP ENVY 5055, HP ENVY 5032, HP ENVY 5010, HP ENVY 5070, HP DeskJet 2680, HP DeskJet 3772, HP DeskJet 3730, HP DeskJet 3752, HP DeskJet 3732, HP DeskJet 2621, HP DeskJet 2620, HP DeskJet 2623, HP DeskJet 3733, HP DeskJet 2600, HP DeskJet 3755, HP DeskJet 2622, HP DeskJet 3758, HP DeskJet 3735, HP DeskJet 2624, HP DeskJet 2628, HP ENVY 5020, HP ENVY 5000, HP DeskJet 2630, HP DeskJet 2652, HP DeskJet 2632, HP DeskJet 3721, HP DeskJet 3720, HP DeskJet 2634, HP DeskJet 2633, HP DeskJet 3700, HP DeskJet 2655, HP DeskJet 3722, HP DeskJet 2636, HP DeskJet 2635, HP DeskJet 3724 See more",
B0BQQXZD4H,E-Z Ink,E-Z Ink (TM Compatible TN660 Toner Cartridge Replacement for Brother TN660 TN-660 TN 660 TN630 Compatible with HL-L2300D HL-L2380DW HL-L2320D DCP-L2540DW MFC-L2700DW MFC-L2685DW Printer (2 Black),27.99,19,,,Electronics,0,4.6,668, , ,0,2,No,TN660*2Black, ,Compatible with HL-L2300D HL-L2305W HL-L2315DW HL-L2320D HL-L2340DW HL-L2360DW HL-L2380DW MFC-L2680W MFC-L2700DW MFC-L2705DW MFC-L2707DW MFC-L2720DW MFC-L2740DW MFC-L2685DW DCP-L2520DW DCP-L2540DW Laser Printers See more,TN660*2Black, , ,,
B0CDJVQTCT,SUDLTO,"TN760 TN-760 Compatible with Brother TN760 TN730 Toner TN-730/TN-760 to Use with MFC-L2750DW HL-L2370DW MFC-L2710DW HL-L2350DW DCP-L2550DW HL-L2390DW Printer (2 Black, High Yield) 2 pack of TN760",29.98,20,,1,Office Products,5517,4.7,129,1.07 Kilograms, ,0,2,No,2 pack of TN760, ,2 pack of tn760 tn-760,2 pack of TN760, , ,,
B08VDS4Y5H,HP,"HP Laserjet MFP M234sdw Wireless Black/White All-in-One Laser Printer, Instant Ink Ready (6GX01F#BGJ)",179,10,3,,Electronics,12495,4.2,202,21 Pounds,"12.13""D x 16.46""W x 11.59""H",0,2,No,Wi-Fi,Laser,"Auto-Duplex, Network-Ready, Energy Star Certified, Cloud Print Enabled, Works with Alexa",Gray,Monochrome, ,21 Pounds,
B0CL658GVW,Zoolion,"Thermal Portable Printers Wireless for Travel, Small Wireless Printer for iPhone & Laptop, Inkless Printer Supports A4 & 8.5x11/2/3/4 inch Paper, Mobile Printer for Vehicles, Office, School, Hotel Grey",149.99,22,3,2,Electronics,292727,4.6,66,992 Grams,12.2 x 3.62 x 4.48 inches,0,2,No,"Bluetooth, USB",Thermal,"Supports Rear-feed and Roll-fed Printing, Upgrade 304DPI Portable Thermal Printer, Upgrade Wireless Small Printer, Inkless Portable Printer Support 8.5''x 11'' US Letter/A4/2''/3''/4'' Thermal Paper, Upgrade Bluetooth Portable Printers for 2500mAh See more",Grey,Monochrome,1,15 ppm,
B08ZHZJQJH,Ankink,ANKINK Remanufactured Ink Cartridge Replacement for HP Ink 65 XL 65XL (Black and Color Combo Pack) for HP65 5055 5000 5052 5010 5070 5014 3755 3700 3772 2600 3752 2652 2655 2622 2640 Printers BK color,27.99,27,,,Electronics,2190,4.5,1471,3.84 ounces,4.33 x 1.57 x 2.76 inches,1,2,No,Ankink, ,600, ,Remanufactured, ,"HP AMP 125, HP DeskJet Ink Advantage 2640, HP ENVY 5012, HP ENVY 5014, HP ENVY 5052, HP ENVY 5030, HP ENVY 5055, HP ENVY 5010, HP ENVY 5070, HP DeskJet 3730, HP DeskJet 3752, HP DeskJet 3732, HP DeskJet 2600, HP DeskJet 3755, HP DeskJet 2622, HP DeskJet 3758, HP DeskJet 2624, HP ENVY 5020, HP ENVY 5000, HP DeskJet 2652, HP DeskJet 3721, HP DeskJet 3720, HP DeskJet 3700, HP DeskJet 3722, HP DeskJet 2655, HP DeskJet 2636, HP DeskJet 2635 See more",
B0CCRQTGGS,Airmall,"Embossing Label Maker,Omega S Vintage Embossed Label Maker Machine, Old School Label Printer, Protable Handheld Retro Embosser Labeler with 6 Rolls 3D Embossing Label for Home School Kitchen and DIY Blue with Black*3、Pink、Lake Blue、Lake Green",22.99,24,,7,Electronics,12759,3.7,220,9.9 ounces,"5""D x 3""W x 5""H",4,2,No,Manual,Manual Embossing,"Embossing label maker，Retro Label maker, Handheld Label Maker, Old school Label maker, Embossing Label Maker, Vintage label maker See more",Blue with Black*3、Pink、Lake Blue、Lake Green,Color,5,5,
B0B52F3L9G,Epson,"Epson EcoTank ET-28 Series Wireless Color All-in-One Cartridge-Free Supertank Inkjet Printer with Scan and Copy, Bluetooth, WiFi, AirPrint, Photo Printing, Bundle with USB Cable (Black)",299,23,3,1,Electronics,151973,5,4,20 pounds,"14.8""D x 22.8""W x 10""H",0,2,No,"Bluetooth, USB, Ethernet",Inkjet,"Bluetooth,Wireless",Black,Color,5 ppm,10 ppm,
B08NY1QVDZ,HP,"HP DeskJet Plus 4158 All-in-One Inkjet Printer, Scanner, Copy, Mobile Print, Instant Ink Ready, Wireless Printers for Home and Office, Dual-band Wi-Fi, 7FS76A (Renewed)",69.99,20,,,Electronics,1298,4,929,12.82 pounds,"13.07""D x 16.85""W x 7.87""H",0,2,No,Wi-Fi,Inkjet,"Wireless, Scan To E-Mail, Auto Document Feeder, Double Sided Scanning", ,Android, ,"Photo, Sheetfed",
B08P3X7LHT,Canon,"Canon PIXMA G1220 Single Function MegaTank Inkjet Printer, Print Only, Black, (4469C002)",167,12,3,,Electronics,201893,3.8,359,10.6 Pounds,13 x 17.6 x 5.4 inches,0,2,yes,USB,Inkjet,wireless,Black,Color,5 ppm,9.1,
B0CL658GVW,Zoolion,"Thermal Portable Printers Wireless for Travel, Small Wireless Printer for iPhone & Laptop, Inkless Printer Supports A4 & 8.5x11/2/3/4 inch Paper, Mobile Printer for Vehicles, Office, School, Hotel Grey",149.99,22,3,2,Electronics,292727,4.6,66,992 Grams,12.2 x 3.62 x 4.48 inches,0,2,No,"Bluetooth, USB",Thermal,"Supports Rear-feed and Roll-fed Printing, Upgrade 304DPI Portable Thermal Printer, Upgrade Wireless Small Printer, Inkless Portable Printer Support 8.5''x 11'' US Letter/A4/2''/3''/4'' Thermal Paper, Upgrade Bluetooth Portable Printers for 2500mAh See more",Grey,Monochrome,1,15 ppm,
B09VF4Z2WQ,Rollo,"Rollo Wireless Shipping Label Printer - Wi-Fi Thermal Label Printer for Shipping Packages - AirPrint from iPhone, iPad, Mac - 4x6 Label Printer",279.99,17,2,,Electronics,0,4.3,1062,3.5 Pounds,"3""D x 7""W x 3.5""H",0,2,No,"Wi-Fi, USB",Thermal,"AirPrint Enabled, WiFi Ready",white,Monochrome, ,3.5 Pounds,
B09WZBX4Z1,Brother,"Brother MFC-J1170DW Wireless Color Inkjet All-in-One Printer with Mobile Device Printing, NFC, Cloud Printing & Scanning, Refresh Subscription and Amazon Dash Replenishment Ready",129.99,20,3,2,Electronics,5345,4.2,562,16.4 Pounds,13.5 x 15.7 x 6.8 inches,0,2,No,"wired, wireless",Inkjet,Auto-Duplex,Black,Color,16.5 ppm,17 ppm,
B0B2F4P786,HP,"HP LaserJet Pro 4001n Printer, Print, Fast speeds, Easy setup, Mobile printing, Advanced security, Best for small teams, Ethernet/USB only",198,17,3,,Electronics,11693,3.8,66,18.12 Pounds,"14.06""D x 15""W x 8.5""H",0,2,No,"USB, Ethernet",Laser,"Dual Paper Tray, HP Pro Wolf Security, Works with Alexa",white,Monochrome, ,18.12 Pounds,
B0C779PRCL,MUNBYN,"MUNBYN Bluetooth Thermal Label Maker,Label Makers, Portable Label Printer,Sticker Printer,Labeler for Office Home School Organized Storage, Barcode,Office Supplies, Home (Tiffany)",17.99,23,,2,Electronics,24066,4.3,866,5.6 ounces,3.19 x 4.8 x 2.05 inches,3,2,No,Bluetooth,Thermal,"Bluetooth,Portable",Blue,Color,20.00,20.00,
B0995JWCT1,POLONO,"POLONO Thermal Label Printer, 4x6 Shippping Label Printer for Shipping Packages, Commercial Thermal Label Maker, Compatible with Amazon, Ebay, Etsy, Shopify, FedEx, etc, Support Windows and Mac (Gray) USB Gray",99.99,23,3,6,Electronics,6794,4.3,1021,1.9 Kilograms,"6.18""D x 6.18""W x 10.91""H",18,2,No,USB,Thermal,Easy to Set up,Gray,Monochrome, ,1.9 Kilograms,
B0C7P5T9D9,Ponek,"Portable Printers Wireless for Travel, M08F-Letter Wireless Inkless Portable Printer, Blutooth Thermal Printer, Tattoo Printer Supports 8.5"" X 11"" Thermal Paper, Travel Printer for Office, Home",159.99,22,2,,Electronics,75862,4.9,29,2.07 pounds,"2.6""D x 12.2""W x 1.6""H",7,2,yes,"Bluetooth, USB",Thermal,"Wireless, Portable, Inkless Thermal Printing, Compatible with Mobile Phone & PC, Long-lasting and Fast Charging Battery See more",Black,Monochrome,53.00,53.00,
B07CBV7YJ8,‎HUANUO,"HUANUO Printer Stand with Cable Management and Storage Drawer, Printer Table with Locking Wheels, 14.1-inch Maximum Height Printer Cart for Under Desk, Home, Office, HNDPS",39.99,23,,,Office Products,10483,4.5,5749,‎6.34 pounds,‎17.1 x 13.2 x 13.2 inches,3,2,No, , , , , , ,,
B08XBKYF4W,Printers Jack,Printers Jack 440ml Sublimation Ink for EcoTank Supertank Inkjet Printer ET-2400 ET-2720 ET-2760 ET-2800 ET-2803 ET-2830 ET-4800 ET-3760 ET-2850 ET-7720 /Upgrade Version/Offer Free ICC Printing 440ml Multicolor,32.99,22,,4,Electronics,8952,4.8,304,‎1.39 pounds, ,0,2,No,"Yellow, Cyan, Black, Magenta", ,Refill Ink, , , ,,
B09QRJ32YB,Brother,"Brother Compact Monochrome Laser Printer 2300 Series, 250-Sheet, Prints up to 27 ppm, Automatic Duplex Printing, Amazon Dash Replenishment Ready, Tech Deal USB Printer Cable",199.99,20,3,,Electronics,318466, , ,15 Pounds,14.2 x 14 x 7.2 inches,0,2,No,USB,Laser,Monochrome,Black,Monochrome, ,15 Pounds,
B01MZD55F2,HP,"HP LaserJet Pro MFP M227fdn Monochrome All-in-One Printer with built-in Ethernet & 2-sided printing, (G3Q79A)",199,11,3,,Office Products,0,4.2,345,20 Pounds, ,0,2,No,USB,Laser,Auto-Duplex,White,Color,35,30 ppm,
B0BVBWCW9X,Rohon,"952xl Latest Upgrade Compatible Ink Cartridges Combo Pack Replacement for HP 952 XL Use with Officejet Pro 7740 8210 8710 8720 8740 8715 7720 8725 8730 (4 Packs), Black, Cyan, Yellow, Magenta",39.99,24,,,Electronics,0,4.1,1891, , ,0,2,No,"Black, Cyan, Yellow, Magenta", ,Printer, ,"Black, Cyan, Yellow, Magenta", ,,
B0BB2K5GFW,GZBCKJ,"QY6-0083 Color Printhead, Canon Printhead Replacement for Canon MG7180 iP8720 iP8750 iP8780 7110 MG7520",40.99,13,1,,Electronics,65183,3.5,16,3.2 ounces, ,0,2,No,GZBCKJ, ,Printer, ,Multicolor, ,,
B07FTDNZLZ,BETCKEY,"BETCKEY - Compatible DYMO 30323 (2-1/8"" x 4"") Shipping/Name Badge Labels, Strong Adhesive & Perforated, Compatible with DYMO Labelwriter 450, 4XL, Rollo & Zebra Desktop Printers [16 Rolls/3840 Labels] 16-rolls (3840 Labels)",36.9,21,1,2,Office Products,27140,4.6,254,‎4.85 pounds,‎11.14 x 5.67 x 4.76 inches,0,0,No,"2-1/8"" x 4""", ,BETCKEY, , , ,,
B0BVW1ZMR8,Memoqueen,"Phomemo Bluetooth Thermal Label Printer 4X6 - Wireless Shipping Label Printer for Shipping Packages & Small Business, Compatible with iOS & Android, for USPS, Etsy Amazon Shopify，Pink and White",119.99,21,2,3,Electronics,39183,4.3,117,‎1.13 ounces,"5""D x 7""W x 6""H",10,2,No,"Bluetooth, USB",Thermal,"✅Thermal Printing, ✅Bluetooth and Usb Connection, ✅IOS & Android Phone/Pad, Mac OS, Windows, Chrome OS, Linux, ✅High Speed Shipping Label Printer, ✅Lower Cost ✅Stylish ✅Compact See more",Pink,Monochrome, ,"5""D x 7""W x 6""H",
B0BTGLTBDB,Itari,"Itari Portable Bluetooth Thermal Tattoo Stencil-Printer - M08F Compact Printer for Phone & Laptop, Portable Printers Wireless for Travel, Home Use, Vehicles, Office, School, Support 8.5"" X 11"" Letter Printer Pink",118.39,22,6,9,Electronics,0,4.2,500, ,"14""D x 4.6""W x 3.6""H",0,0,yes,Bluetooth,Thermal,"Portable, Bluetooth Connection, Inkless Printing, Only support thermal paper",Pink,Color, ,,Android
B0CLNT35KW,HUIJUTCHEN,"Mini Sticker Printer - Mini Pocket Printer for iPhone Thermal Printer with 10 Rolls Thermal Paper for Journal, Memo, Photo, Black",27.99,17,,2,Electronics,24572,4.4,44,5.3 Ounces,1.18 x 0.39 x 0.79 inches,0,2,No,Bluetooth,Inkless,Portable,Black,Monochrome,10,10,
B0BVXMBJGH,HP,"HP Color LaserJet Pro 4201dw Wireless Printer, Print, Fast speeds, Easy setup, Mobile printing, Advanced security, Best-for-small teams, Works with Alexa New version",419,19,3,2,Electronics,17626,4.2,1299,17.92 pounds,"16.6""D x 11.3""W x 16.8""H",0,2,No,USB,Laser,"Compact, Works with Alexa",white,Color,33 ppm,35 ppm,
B09TPZ3HLZ,HP,"HP Smart -Tank 6001 Wireless Cartridge-Free all in one printer, this ink -tank printer comes with up to 2 years of ink included, with mobile print, scan, copy (2H0B9A)",239.99,19,3,,Electronics,2604,4.1,1370,14.1 Pounds,16.83 x 7.82 x 14.33 inches,0,2,No,"wired, wireless",Inkjet,"Auto-Duplex, Network-Ready, Refillable Ink Tank, Borderless Printing",Gray,Color,7 ppm,12 ppm,
B0CFD1G1VT,Brother,"Brother HL-L3280CDW Wireless Compact Digital Color Printer with Laser Quality Output, Duplex, Mobile Printing & Ethernet | Includes 4 Month Refresh Subscription Trial¹, Amazon Dash Replenishment Ready New: HL-L3280CDW Adds 2.7"" Touchscreen Display",269.99,24,3,4,Electronics,3720,4.3,3270,33.9 Pounds,15.7 x 10.8 x 15.7 inches,0,2,No,"Wi-Fi, USB, Ethernet",Laser,"Auto-Duplex, Network-Ready",White,Color,27 ppm,27 ppm,
B0BL466Y41,HP,"HP Smart -Tank 5101 Wireless Cartridge-free all in one printer, up to 2 years of ink included, mobile print, scan, copy (1F3Y0A) , White ST 5001",189.99,14,3,2,Electronics,498,4.1,2019,11.09 Pounds,14.23 x 17.11 x 6.19 inches,0,2,No,"Wi-Fi, USB",Inkjet,Refillable Ink Tank,White,Color,5 ppm,12 ppm,
B08QR6P8KV,HP,"HP OfficeJet Pro 9015e Wireless Color All-in-One Printer with bonus 6 months Instant ink with HP+ (1G5L3A),Gray Old Version", ,13,,1,Electronics,0,4.1,6186,20.43 Pounds, ,0,0,No,"wired, wireless",Inkjet,"Wireless, Scan To E-Mail, Auto-Duplex, Double Sided Scanning, Auto-Document Feeder",Gray,Color,18 ppm,22 ppm,
B08X458JFQ,Phomemo,"Phomemo M02S Mini Phone Printer- 300dpi Bluetooth Thermal Tiny Photo Printer for Work List, Plan, Photo Printing, DIY Label Sticker, with Total 6 Rolls Paper, Black Black 1 Printer + 6 Roll Papers",79.99,23,,12,Electronics,0,4.4,1600, , ,0,2,No,"Bluetooth, USB",Thermal,Bluetooth,Black,Monochrome, ,"Transparencies, Labels, Glossy photo paper",
B0CM3BZ7QF,PRINHSJI,"Pocket Printer for iOS&Android,Wireless Mini Sticker Printer with 10 Rolls Thermal Paper, Mini Pocket Bluetooth Thermal Printers, Portable Receipt Printer for Photo Journal Notes Memo,Purple",27.99,24,,2,Electronics,0,3.6,18,416.6 Grams, ,0,0,No,Bluetooth,"Mini,Portable",Portable,Purple,Monochrome,10 ppm,10 ppm,
B0C7Q85VHM,Zoolion,"T02 Mini Sticker Printer, Sticker Printer Machine with 3 White Paper Rolls Gift Box Set, Mini Printer Sticker Printer, Memoking Label Makers, Inkless Sticker Printer for Photo, Journal, Memo Pink 1 Printer + 3 Roll Paper",42.99,24,,6,Electronics,132197,4,164,11.3 ounces,"6.61""D x 1.89""W x 6.5""H",5,2,No,Bluetooth,Thermal,Portable,Pink,Monochrome,15,15,
